IRAN MAU BOM SAUDI! ARAB MINTA TOLONG...,2026-03-01,13.3,iran mau bom saudi,2026-03-01|iran mau bom saudi,dTx1KrZb3oE,"IRAN MAU BOM SAUDI! ARAB MINTA TOLONG INDONESIA, PRABOWO TURUN GUNUNG!",2026-03-01,540.0,4771.0,0:03:44,41.55,,,,,,,,0.0,0.0,1.0,0.0,69.0,5.0,93.24,11.0,42.0,0.0,0.0,,64.636,28054.781,0.0,28054.781,51040.566,5232.0,11398.072,9755.46,4478.0,5893.631,0.0,0.0,0.0,0.0,0.0,0.0,0.0,0.0,17.0,0.7211,,,,0.1833,4.0,1.0,0.0,0.0,,,0.0,0.0,0.0,,0.0,0.0,0.0,,31.0,1.7,1824.0,4771.0,297.3543,1.0,28119.417,14887.0,23.67,iran mau bom saudi
JENDERAL MALAYSIA ANCAM TKI! DUNIA KECAM...,2026-03-01,10.15,jenderal malaysia ancam tki,2026-03-01|jenderal malaysia ancam tki,NvanwTY8nFE,JENDERAL MALAYSIA ANCAM TKI! DUNIA KECAM MALAYSIA JADI PUSAT AGEN YAHUDINYA ASIA,2026-03-01,514.0,9347.0,0:04:03,47.29,,,,,,,,0.0,0.0,8.0,4.0,131.0,10.0,92.91,12.0,228.0,0.0,0.0,,307.125,47866.586,0.0,47866.586,86979.17,10506.0,9760.876,8279.0,8911.0,5166.764,0.0,0.0,9.0,0.0,0.0,0.0,0.0,0.0,41.0,2.9723,,,,176.0,2.0,2.0,0.0,0.0,,,0.0,0.0,0.0,,0.0,0.0,0.0,,88.0,2.18,4030.0,9347.0,631.1491,4.0,48173.711,35563.0,22.7,jenderal malaysia ancam tki
DETIK-DETIK MALAYSIA HANCUR? 70 NEGARA HUJAT...,2026-03-01,7.3,detik detik malaysia hancur,2026-03-01|detik detik malaysia hancur,Yav_SM0FGFE,"DETIK-DETIK MALAYSIA HANCUR? 70 NEGARA HUJAT HABIS, INDONESIA JADI PANGLIMA PBB, MALAYSIA PANIK!",2026-03-01,480.0,7355.0,0:03:54,48.89,,,,,,,,0.0,0.0,0.0,0.0,118.0,4.0,96.72,7.0,75.0,0.0,0.0,,238.066,51451.562,0.0,51451.562,93597.355,9043.0,12548.244,10350.255,7459.0,7038.051,0.0,0.0,0.0,0.0,0.0,0.0,0.0,0.0,39.0,2.8194,,,,0.1665,14.0,0.0,0.0,0.0,,,0.0,0.0,0.0,,0.0,0.0,0.0,,76.0,1.51,5029.0,7355.0,479.4744,0.0,51689.628,24518.0,24.94,detik detik malaysia hancur
MALAYSIA MELONGO! PRABOWO DISAMBUT 7 PENGUASA...,2026-03-02,20.3,malaysia melongo prabowo disambut,2026-03-02|malaysia melongo prabowo disambut,0lYS4fKe_YU,"MALAYSIA MELONGO! PRABOWO DISAMBUT 7 PENGUASA UEA, LALU KE IRAN TANTANG AS & ISRAEL!",2026-03-02,572.0,3346.0,0:03:45,39.5,,,,,,,,0.0,0.0,1.0,2.0,64.0,2.0,96.97,3.0,17.0,0.0,0.0,,81.257,16344.364,0.0,16344.364,29738.82,3627.0,9440.895,8199.289,3150.0,4908.316,0.0,0.0,0.0,0.0,0.0,0.0,0.0,0.0,12.0,0.6056,,,,0.1919,5.0,0.0,0.0,0.0,,,0.0,0.0,0.0,,0.0,0.0,0.0,,56.0,3.04,1843.0,3346.0,209.9815,-1.0,16425.621,12526.0,18.12,malaysia melongo prabowo disambut
KULINER INDONESIA JAJAH MASTERCHEF DUNIA!...,2026-03-02,13.15,kuliner indonesia jajah masterchef,2026-03-02|kuliner indonesia jajah masterchef,FVG5Mf9WS4Y,KULINER INDONESIA JAJAH MASTERCHEF DUNIA! MALAYSIA: KENAPA MASAKAN KITA TAK POPULER MACAM INDO?,2026-03-02,540.0,22949.0,0:02:59,33.28,,,,,,,,2.0,160.0,15.0,3.0,191.0,5.0,97.45,12.0,106.0,0.0,0.0,,2259.153,113655.556,0.0,113655.556,206759.845,19071.0,13711.774,10841.584,15079.0,5040.77,0.0,0.0,0.0,0.0,0.0,0.0,0.0,0.0,281.0,17.708,,,,0.1833,5.0,0.0,0.0,0.0,,,0.0,0.0,0.0,,0.0,0.0,0.0,,60.0,1.3,4599.0,22949.0,1145.7706,12.0,115914.709,181025.0,11.75,kuliner indonesia jajah masterchef
SYOK RI NEGARA PALING AMAN! AS SERANG IRAN...,2026-03-02,10.15,syok ri negara paling,2026-03-02|syok ri negara paling,bK04m5JOK0Y,SYOK RI NEGARA PALING AMAN! AS SERANG IRAN PD3 DIMULAI! JUTAAN ORANG MENGUNGSI KE INDONESIA,2026-03-02,540.0,4487.0,0:03:41,41.06,,,,,,,,0.0,0.0,1.0,0.0,82.0,0.0,100.0,5.0,17.0,0.0,0.0,,153.923,25089.617,0.0,25089.617,45647.528,4988.0,10850.375,9151.469,4207.0,5632.999,0.0,0.0,0.0,0.0,0.0,0.0,0.0,0.0,17.0,1.4154,,,,0.1833,23.0,0.0,0.0,0.0,,,0.0,0.0,0.0,,0.0,0.0,0.0,,28.0,1.43,1954.0,4487.0,276.3624,1.0,25243.54,21656.0,15.75,syok ri negara paling
MALAYSIA RESMI BANGKRUT! RAJA MALAYSIA...,2026-03-02,7.3,malaysia resmi bangkrut raja,2026-03-02|malaysia resmi bangkrut raja,L0z_8IT7JWE,MALAYSIA RESMI BANGKRUT! RAJA MALAYSIA SAMPAI MALU TAK MAMPU LUNASI HUTANG!,2026-03-02,634.0,12196.0,0:04:17,40.58,,,,,,,,0.0,0.0,4.0,3.0,232.0,9.0,96.27,45.0,149.0,0.0,1.0,0.0,1036.809,86266.544,0.0,86266.544,156928.668,16534.0,11911.094,9491.271,13175.0,7565.93,0.0,15.0,265.0,90255.13,1.0,4830.34,4873.779,0.0,102.0,8.137,0.0799,1.0,1.0,0.2094,10.0,0.0,1.0,0.0,,,0.0,0.0,0.0,,0.0,0.0,0.0,,89.0,2.2,4044.0,12196.0,871.6207,1.0,92177.133,50829.0,20.82,malaysia resmi bangkrut raja
OPM KOCAR-KACIR‼️ PESAN KERAS BUAT AUSTRALIA...,2026-03-03,20.15,opm kocar kacir pesan,2026-03-03|opm kocar kacir pesan,ob4NCNgmVwU,OPM KOCAR-KACIR‼️ PESAN KERAS BUAT AUSTRALIA: BERHENTI MAIN DUA KAKI ATAU HADAPI KONSEKUENSI MATI‼️,2026-03-03,635.0,2632.0,0:04:33,43.13,,,,,,,,0.0,0.0,2.0,1.0,62.0,1.0,98.41,4.0,33.0,0.0,0.0,,126.635,15143.364,0.0,15143.364,27552.058,3187.0,10389.162,8645.139,2652.0,5799.791,0.0,0.0,10.0,0.0,0.0,0.0,0.0,0.0,15.0,1.2203,,,,0.2098,6.0,1.0,0.0,0.0,,,0.0,0.0,0.0,,0.0,0.0,0.0,,55.0,3.74,1471.0,2632.0,200.2386,1.0,15269.999,12421.0,14.3,opm kocar kacir pesan
"RI GUNCANG DUNIA, JET TEMPUR KF-21 BORAMAE...",2026-03-03,16.0,ri guncang dunia jet,2026-03-03|ri guncang dunia jet,dgl3K6ZVA2k,"RI GUNCANG DUNIA, JET TEMPUR KF-21 BORAMAE BIKIN BARAT GEMETAR KETAKUTAN‼️",2026-03-03,510.0,3049.0,0:03:13,37.98,,,,,,,,1.0,80.0,4.0,3.0,69.0,1.0,98.57,3.0,13.0,0.0,0.0,,89.938,35506.193,0.0,35506.193,64574.588,2985.0,25283.707,21633.028,2554.0,11681.801,0.0,0.0,0.0,0.0,0.0,0.0,0.0,0.0,16.0,0.7762,,,,0.1749,3.0,0.0,0.0,0.0,,,0.0,0.0,0.0,,0.0,0.0,0.0,,19.0,2.3,825.0,3049.0,164.064,1.0,35596.131,13975.0,16.05,ri guncang dunia jet
MALAYSIA GEMETAR‼️ INDONESIA RESMI BORONG...,2026-03-03,13.15,malaysia gemetar indonesia resmi,2026-03-03|malaysia gemetar indonesia resmi,dgl3K6ZVA2k,MALAYSIA GEMETAR‼️ INDONESIA RESMI BORONG 6 KAPAL SELAM MONSTER ITALIA UNTUK RATAKAN PENYUSUP‼️,2026-03-03,510.0,3660.0,0:03:21,39.46,,,,,,,,1.0,80.0,3.0,2.0,61.0,0.0,100.0,7.0,13.0,0.0,0.0,,137.543,23291.53,0.0,23291.53,42371.104,3964.0,12410.985,10688.977,3414.0,6422.055,0.0,0.0,0.0,0.0,0.0,0.0,0.0,0.0,21.0,1.1878,,,,0.1748,9.0,0.0,0.0,0.0,,,0.0,0.0,0.0,,0.0,0.0,0.0,,17.0,1.81,939.0,3660.0,204.6208,1.0,23429.073,16852.0,16.77,malaysia gemetar indonesia resmi
BANGKRUT‼️ EJEK INDONESIA MISKIN...,2026-03-03,10.15,bangkrut ejek indonesia miskin,2026-03-03|bangkrut ejek indonesia miskin,QdycOhMLjNY,"BANGKRUT‼️ EJEK INDONESIA MISKIN, SULTAN MALAYSIA MALU NEGARA TERLILIT HUTANG TERBESAR SE-ASEAN‼️",2026-03-03,540.0,6690.0,0:03:52,43.05,,,,,,,,0.0,0.0,6.0,2.0,148.0,3.0,98.01,11.0,89.0,0.0,0.0,,511.295,40974.481,0.0,40974.481,74542.847,8061.0,11217.885,9247.345,6645.0,6207.21,0.0,0.0,0.0,0.0,0.0,0.0,0.0,0.0,58.0,3.9007,,,,0.1832,11.0,0.0,0.0,0.0,,,0.0,0.0,0.0,,0.0,0.0,0.0,,52.0,1.38,3766.0,6690.0,432.0534,4.0,41485.776,34006.0,16.32,bangkrut ejek indonesia miskin
MALAYSIA KIAMAT‼️ FILIPINA RESMI CAPLOK SABAH...,2026-03-03,7.15,malaysia kiamat filipina resmi,2026-03-03|malaysia kiamat filipina resmi,93TQdQtgfOQ,MALAYSIA KIAMAT‼️ FILIPINA RESMI CAPLOK SABAH KARMA CAPLOK KEDAULATAN INDONESIA,2026-03-03,618.0,11131.0,0:04:08,40.25,,,,,,,,0.0,0.0,3.0,2.0,157.0,3.0,98.13,9.0,83.0,0.0,0.0,,427.793,65183.171,0.0,65183.171,118588.102,13511.0,10634.75,8777.152,11151.0,5894.405,0.0,12.0,196.0,0.0,0.0,0.0,0.0,0.0,63.0,4.4029,0.0827,1.0,1.0,0.2048,8.0,0.0,0.0,0.0,,,0.0,0.0,0.0,,0.0,0.0,0.0,,116.0,2.92,3979.0,11131.0,769.1249,1.0,65610.963,46956.0,20.97,malaysia kiamat filipina resmi
KIBARKAN BENDERA PERANG! RI-MALAYSIA WASPADA...,2026-03-04,21.0,kibarkan bendera perang ri,2026-03-04|kibarkan bendera perang ri,S6SVN5iXCnM,"KIBARKAN BENDERA PERANG! RI-MALAYSIA WASPADA, ANCAMAN PD 3 DI DEPAN MATA, TNI SIAP ANGKAT SENJATA",2026-03-04,607.0,6216.0,0:03:29,34.59,,,,,,,,0.0,0.0,1.0,1.0,108.0,4.0,96.43,13.0,34.0,0.0,0.0,,182.328,35643.5,0.0,35643.5,64845.188,6880.0,11141.785,9425.173,5820.0,5761.462,0.0,4.0,41.0,0.0,0.0,0.0,0.0,0.0,27.0,1.7439,,,,0.1999,0.0,0.0,0.0,0.0,,,0.0,0.0,0.0,,0.0,0.0,0.0,,72.0,2.5,2875.0,6216.0,362.4924,0.0,35825.828,18968.0,25.02,kibarkan bendera perang ri
HARGA DIRI BANGSA DIINJAK-INJAK MALAYSIA!...,2026-03-04,18.15,harga diri bangsa diinjak,2026-03-04|harga diri bangsa diinjak,ob4NCNgmVwU,HARGA DIRI BANGSA DIINJAK-INJAK MALAYSIA! TNI AL SIKAT HABIS PARASIT EKONOMI DI PERAIRAN RIAU!,2026-03-04,540.0,3046.0,0:03:12,35.63,,,,,,,,0.0,0.0,0.0,0.0,75.0,1.0,98.68,8.0,63.0,0.0,0.0,,147.599,14699.687,0.0,14699.687,26745.241,3030.0,10169.293,8826.812,2630.0,4877.222,0.0,0.0,0.0,0.0,0.0,0.0,0.0,0.0,20.0,1.1066,,,,0.1833,10.0,0.0,0.0,0.0,,,0.0,0.0,0.0,,0.0,0.0,0.0,,19.0,1.69,1127.0,3046.0,162.787,0.0,14847.286,14502.0,15.81,harga diri bangsa diinjak
OPM KOCAR-KACIR‼️ PESAN KERAS BUAT AUSTRALIA... (Shorts),2026-03-04,17.0,opm kocar kacir pesan,2026-03-04|opm kocar kacir pesan,_PwyU5ngFPo,OPM KOCAR-KACIR‼️ PESAN KERAS BUAT AUSTRALIA: BERHENTI MAIN DUA KAKI ATAU HADAPI KONSEKUENSI MATI‼️,2026-03-04,118.0,3448.0,0:01:47,90.86,82.54,,,,,,,0.0,0.0,2.0,0.0,153.0,7.0,95.63,5.0,11.0,0.0,0.0,,16.833,0.0,0.0,0.0,,,,,,314.856,0.0,1.0,2641.0,0.0,0.0,0.0,0.0,0.0,31.0,0.4814,,,,,0.0,,,0.0,,,0.0,0.0,0.0,,0.0,0.0,0.0,,0.0,,0.0,6166.0,102.9965,2.0,1007.687,10708.0,8.67,opm kocar kacir pesan
KARMA AMBALAT NYATA! KINI MALAYSIA MERADANG...,2026-03-04,15.15,karma ambalat nyata kini,2026-03-04|karma ambalat nyata kini,NX1YAttQJyI,"KARMA AMBALAT NYATA! KINI MALAYSIA MERADANG SABAH DICURI FILIPINA, MARCOS JR MURKA BESAR!",2026-03-04,600.0,5183.0,0:04:13,42.33,,,,,,,,0.0,0.0,4.0,4.0,107.0,2.0,98.17,5.0,38.0,0.0,0.0,,336.348,39310.355,0.0,39310.355,71509.314,6044.0,13893.397,11831.455,5147.0,7653.417,0.0,0.0,0.0,0.0,0.0,0.0,0.0,0.0,39.0,3.6303,,,,0.2,5.0,0.0,2.0,0.0,,,0.0,0.0,0.0,,0.0,0.0,0.0,,58.0,1.98,2934.0,5183.0,365.6658,0.0,39646.703,25551.0,17.02,karma ambalat nyata kini
SERING HINA RI! RAJA MALAYSIA UMUMKAN MALAYSIA BANGKRUT...,2026-03-05,18.15,sering hina ri raja,2026-03-05|sering hina ri raja,xwV38aqLNvA,"SERING HINA RI! RAJA MALAYSIA UMUMKAN MALAYSIA BANGKRUT, MALAH MINTA BANTUAN KE INDONESIA",2026-03-05,540.0,5795.0,0:03:39,40.59,,,,,,,,0.0,0.0,1.0,1.0,121.0,5.0,96.03,10.0,127.0,0.0,0.0,,212.765,33198.82,0.0,33198.82,60398.784,6680.0,10684.377,9041.734,5653.0,5781.952,0.0,3.0,47.0,0.0,0.0,0.0,0.0,0.0,28.0,1.7463,,,,0.1832,8.0,0.0,0.0,0.0,,,0.0,0.0,0.0,,0.0,0.0,0.0,,67.0,3.03,2210.0,5795.0,352.801,0.0,33411.585,26566.0,18.17,sering hina ri raja
20 NEGARA MERINDING! TNI AL KIRIM FREGAT SILUMAN...,2026-03-05,13.15,20 negara merinding tni,2026-03-05|20 negara merinding tni,wDSSe_Xh2xk,"20 NEGARA MERINDING! TNI AL KIRIM FREGAT SILUMAN KE AUSTRALIA, MALAYSIA AUTO IRI BESAR!",2026-03-05,540.0,2727.0,0:03:24,37.78,,,,,,,,0.0,0.0,1.0,2.0,39.0,1.0,97.5,0.0,20.0,0.0,0.0,,132.206,13789.567,0.0,13789.567,25100.609,2913.0,9827.96,8616.756,2554.0,5099.372,0.0,0.0,7.0,0.0,0.0,0.0,0.0,0.0,21.0,1.5631,,,,0.1831,7.0,0.0,0.0,0.0,,,0.0,0.0,0.0,,0.0,0.0,0.0,,13.0,1.33,975.0,2727.0,154.532,-1.0,13921.773,11032.0,17.68,20 negara merinding tni
INDONESIA-TURKI RESMI BERSATU! PT DI UBAH CN235...,2026-03-05,10.15,indonesia turki resmi bersatu,2026-03-05|indonesia turki resmi bersatu,UL5Qyg1f9gU,INDONESIA-TURKI RESMI BERSATU! PT DI UBAH CN235 JADI PREDATOR ASEAN! MALAYSIA LANGSUNG PUCAT,2026-03-05,570.0,4108.0,0:03:55,41.34,,,,,,,,0.0,0.0,1.0,1.0,71.0,2.0,97.26,11.0,24.0,0.0,0.0,,237.007,23468.926,0.0,23468.926,42698.595,4665.0,11432.02,9152.968,3735.0,5773.543,0.0,0.0,0.0,0.0,0.0,0.0,0.0,0.0,23.0,2.2046,,,,0.1915,11.0,0.0,0.0,0.0,,,0.0,0.0,0.0,,0.0,0.0,0.0,,22.0,1.02,2157.0,4108.0,268.913,0.0,23705.932,19347.0,17.84,indonesia turki resmi bersatu
MALAYSIA DI AMBANG BUBAR? RAKYAT SABAH-SARAWAK...,2026-03-05,7.15,malaysia di ambang bubar,2026-03-05|malaysia di ambang bubar,N50byjGsspE,"MALAYSIA DI AMBANG BUBAR? RAKYAT SABAH-SARAWAK BUANG IDENTITAS MELAYU, PILIH JADI BAGIAN INDONESIA!",2026-03-05,570.0,13045.0,0:03:55,41.32,,,,,,,,0.0,0.0,7.0,4.0,270.0,2.0,99.26,20.0,126.0,0.0,0.0,,696.428,78702.787,0.0,78702.787,143182.995,15356.0,11309.873,9324.238,12660.0,6103.822,0.0,0.0,0.0,0.0,0.0,0.0,0.0,0.0,89.0,7.0274,0.0211,2.0,1.0,0.1915,13.0,1.0,0.0,0.0,,,0.0,0.0,0.0,,0.0,0.0,0.0,,135.0,1.58,8551.0,13045.0,853.4666,3.0,79399.215,56076.0,20.99,malaysia di ambang bubar
MEMALUKAN! EJEK DAN HINA RUPIAH LEMAH...,2026-03-06,10.15,memalukan ejek dan hina,2026-03-06|memalukan ejek dan hina,jIFMCrfQOpE,"MEMALUKAN! EJEK DAN HINA RUPIAH LEMAH, INDONESIA TAMPAR KERAS NETIZEN MALAYSIA YANG SOMBONG!",2026-03-06,540.0,2954.0,0:03:21,37.39,,,,,,,,1.0,80.0,0.0,0.0,57.0,1.0,98.28,6.0,19.0,0.0,0.0,,204.377,21404.814,0.0,21404.814,38939.959,3642.0,12826.073,10691.916,3036.0,7309.231,0.0,0.0,0.0,0.0,0.0,0.0,0.0,0.0,33.0,1.9692,,,,0.1832,12.0,0.0,0.0,0.0,,,0.0,0.0,0.0,,0.0,0.0,0.0,,17.0,2.12,803.0,2954.0,165.6792,0.0,21609.191,13900.0,16.46,memalukan ejek dan hina
BUKBER DIPENUHI BANGLADESH! RIBUAN RAKYAT...,2026-03-06,7.15,bukber dipenuhi bangladesh ribuan,2026-03-06|bukber dipenuhi bangladesh ribuan,PmXf1B9LHSw,BUKBER DIPENUHI BANGLADESH! RIBUAN RAKYAT TINGGALKAN MALAYSIA DAN PINDAH KE INDONESIA,2026-03-06,540.0,6407.0,0:03:28,38.56,,,,,,,,0.0,0.0,1.0,1.0,82.0,1.0,98.8,3.0,39.0,0.0,0.0,,308.857,36018.615,0.0,36018.615,65529.902,6568.0,11685.075,9977.147,5608.0,5679.859,0.0,0.0,0.0,0.0,0.0,0.0,0.0,0.0,44.0,2.8341,,,,0.1832,6.0,0.0,0.0,0.0,,,0.0,0.0,0.0,,0.0,0.0,0.0,,31.0,1.93,1605.0,6407.0,370.5735,0.0,36327.472,36078.0,15.38,bukber dipenuhi bangladesh ribuan
MALAYSIA MULAI GELISAH‼️ IKN 95% JADI...,2026-03-07,21.0,malaysia mulai gelisah ikn,2026-03-07|malaysia mulai gelisah ikn,A5O6I2ZB8k4,"MALAYSIA MULAI GELISAH‼️ IKN 95% JADI, SABAH-SARAWAK TERANCAM TINGGALKAN JIRAN",2026-03-07,667.0,17004.0,0:05:01,45.22,,,,,,,,0.0,0.0,14.0,3.0,251.0,7.0,97.29,24.0,50.0,0.0,3.0,0.0,982.312,100809.31,0.0,100809.31,183416.384,21912.0,10697.952,8370.591,17145.0,6257.951,0.0,21.0,511.0,124718.96,3.0,0.0,4507.439,0.0,99.0,8.8738,0.1534,1.0,1.0,0.2187,7.0,1.0,0.0,0.0,,,0.0,0.0,0.0,,0.0,0.0,0.0,,148.0,1.45,10205.0,17004.0,1424.5904,11.0,106299.061,102441.0,14.75,malaysia mulai gelisah ikn
DUNIA GEMETAR! MEDIA AMERIKA BOCORKAN...,2026-03-07,16.15,dunia gemetar media amerika,2026-03-07|dunia gemetar media amerika,Cb1mp5VDRFs,DUNIA GEMETAR! MEDIA AMERIKA BOCORKAN REKAMAN JANTUNG ISRAEL MELEDAK TERKENA RUDAL IRAN!,2026-03-07,540.0,6977.0,0:03:39,40.7,,,,,,,,0.0,0.0,1.0,1.0,108.0,1.0,99.08,3.0,25.0,0.0,0.0,,380.404,44989.259,0.0,44989.259,81841.379,8155.0,12204.202,10035.73,6706.0,6501.085,0.0,0.0,0.0,0.0,0.0,0.0,0.0,0.0,46.0,3.1999,,,,0.1832,1.0,0.0,0.0,0.0,,,0.0,0.0,0.0,,0.0,0.0,0.0,,62.0,2.01,3081.0,6977.0,425.9941,0.0,45369.664,20744.0,27.82,dunia gemetar media amerika
22 NEGARA SERENTAK DEKLARASIKAN PERANG‼️...,2026-03-07,13.15,22 negara serentak deklarasikan,2026-03-07|22 negara serentak deklarasikan,jIFMCrfQOpE,22 NEGARA SERENTAK DEKLARASIKAN PERANG‼️ MALAYSIA SYOK INDONESIA JADI KUNCI KEMENANGAN,2026-03-07,540.0,7248.0,0:03:45,41.8,,,,,,,,0.0,0.0,1.0,0.0,81.0,2.0,97.59,17.0,24.0,0.0,0.0,,174.532,38002.414,0.0,38002.414,69143.2,8172.0,10003.356,8460.989,6912.0,5273.91,0.0,0.0,0.0,0.0,0.0,0.0,0.0,0.0,25.0,1.4096,,,,0.1832,9.0,0.0,0.0,0.0,,,0.0,0.0,0.0,,0.0,0.0,0.0,,64.0,1.61,3969.0,7248.0,454.4802,1.0,38176.946,38134.0,15.71,22 negara serentak deklarasikan
TIMOR LESTE IRI LIHAT KEMAJUAN PESAT PAPUA‼️...,2026-03-07,10.15,timor leste iri lihat,2026-03-07|timor leste iri lihat,OYdkSnb5CuY,TIMOR LESTE IRI LIHAT KEMAJUAN PESAT PAPUA‼️ DULU INGINKAN PISAH SEKARANG NYESEL MAU GABUNG LAGI‼️,2026-03-07,540.0,6052.0,0:03:40,40.91,,,,,,,,0.0,0.0,3.0,0.0,97.0,2.0,97.98,2.0,33.0,0.0,0.0,,290.831,32355.909,0.0,32355.909,58867.35,6606.0,10652.796,8911.194,5526.0,5422.997,0.0,0.0,0.0,0.0,0.0,0.0,0.0,0.0,35.0,2.6542,,,,0.1832,6.0,0.0,0.0,0.0,,,0.0,0.0,0.0,,0.0,0.0,0.0,,42.0,1.34,3128.0,6052.0,371.4006,3.0,32646.74,31646.0,15.99,timor leste iri lihat
MALAYSIA PANIK‼️ INDONESIA BANGKIT DI BORNEO...,2026-03-08,22.0,malaysia panik indonesia bangkit,2026-03-08|malaysia panik indonesia bangkit,gSP28l6P29o,"MALAYSIA PANIK‼️ INDONESIA BANGKIT DI BORNEO, SABAH-SARAWAK TERKEJUT KEMAJUAN IKN",2026-03-08,601.0,5270.0,0:04:10,41.61,,,,,,,,0.0,0.0,1.0,2.0,83.0,0.0,100.0,1.0,14.0,0.0,0.0,,408.836,31742.204,0.0,31742.204,57751.471,6531.0,11048.684,8842.669,5227.0,6104.499,0.0,8.0,83.0,0.0,0.0,0.0,0.0,0.0,40.0,3.607,,,,0.2001,0.0,0.0,0.0,0.0,,,0.0,0.0,0.0,,0.0,0.0,0.0,,109.0,3.49,3125.0,5270.0,366.1051,-1.0,32151.039,22259.0,18.89,malaysia panik indonesia bangkit
MALAYSIA MULAI GELISAH‼️ IKN 95% JADI... (Shorts),2026-03-08,19.0,malaysia mulai gelisah ikn,2026-03-08|malaysia mulai gelisah ikn,DJzKZx_awtQ,"MALAYSIA MULAI GELISAH‼️ IKN 95% JADI, SABAH-SARAWAK TERANCAM TINGGALKAN JIRAN",2026-03-08,114.0,6097.0,0:01:38,86.74,84.28,,,,,,,0.0,0.0,1.0,0.0,190.0,15.0,92.68,17.0,4.0,0.0,0.0,,31.837,0.0,0.0,0.0,,,,,,331.369,0.0,5.0,4348.0,0.0,0.0,0.0,0.0,0.0,57.0,0.8667,,,,,0.0,,,0.0,,,0.0,0.0,0.0,,0.0,0.0,0.0,,0.0,,0.0,10492.0,167.9672,1.0,1819.899,16831.0,9.54,malaysia mulai gelisah ikn
ISRAEL MELEDAK! RUDAL 1 TON IRAN RATAKAN...,2026-03-08,13.15,israel meledak rudal 1,2026-03-08|israel meledak rudal 1,Cb1mp5VDRFs,"ISRAEL MELEDAK! RUDAL 1 TON IRAN RATAKAN JANTUNG KOTA, SEMUA HANCUR LEBUR!",2026-03-08,540.0,3702.0,0:03:52,43.0,,,,,,,,0.0,0.0,1.0,2.0,71.0,2.0,97.26,3.0,3.0,0.0,0.0,,374.614,25563.531,0.0,25563.531,46505.013,4566.0,12609.819,10185.066,3688.0,7008.553,0.0,0.0,0.0,0.0,0.0,0.0,0.0,0.0,35.0,2.9695,,,,0.1789,9.0,0.0,0.0,0.0,,,0.0,0.0,0.0,,0.0,0.0,0.0,,28.0,1.47,1903.0,3702.0,238.7553,-1.0,25938.144,14520.0,18.45,israel meledak rudal 1
ISRAEL TERBAKAR! IRAN LUNCURKAN RUDAL...,2026-03-08,10.15,israel terbakar iran luncurkan,2026-03-08|israel terbakar iran luncurkan,DJzKZx_awtQ,ISRAEL TERBAKAR! IRAN LUNCURKAN RUDAL KHORRAMSHAHR-4 DEMI BALAS PEMBANTAIAN NYAWA ANAK-ANAK!,2026-03-08,540.0,2583.0,0:03:45,41.85,,,,,,,,0.0,0.0,0.0,0.0,59.0,3.0,95.16,6.0,15.0,0.0,0.0,,160.053,15183.493,0.0,15183.493,27623.76,3141.0,10803.191,8794.575,2557.0,5942.228,0.0,0.0,0.0,0.0,0.0,0.0,0.0,0.0,21.0,1.3389,,,,0.1832,5.0,0.0,0.0,0.0,,,0.0,0.0,0.0,,0.0,0.0,0.0,,27.0,3.06,881.0,2583.0,162.1333,0.0,15343.545,10532.0,17.76,israel terbakar iran luncurkan
RUSIA KERAKAN PESAWAT NUKLIR...,2026-03-08,7.15,rusia kerakan pesawat nuklir,2026-03-08|rusia kerakan pesawat nuklir,LjUuSVQcdHE,"RUSIA KERAKAN PESAWAT NUKLIR, KAPAL INDUK AS KENA DRONE, ISRAEL MELEDAK!",2026-03-08,540.0,4793.0,0:03:55,43.69,,,,,,,,0.0,0.0,1.0,2.0,87.0,2.0,97.75,2.0,11.0,0.0,0.0,,246.621,36652.343,0.0,36652.343,66673.06,6012.0,13896.011,11089.997,4798.0,7713.313,0.0,0.0,0.0,0.0,0.0,0.0,0.0,0.0,27.0,2.194,,,,0.1832,8.0,5.0,0.0,0.0,,,0.0,0.0,0.0,,0.0,0.0,0.0,,43.0,1.66,2584.0,4793.0,314.0734,-1.0,36898.964,15275.0,24.3,rusia kerakan pesawat nuklir
"KARMA INSTAN‼️ DULU HINA TKI, SEKARANG WARGA MALAYSIA...",2026-03-09,22.15,karma instan dulu hina,2026-03-09|karma instan dulu hina,OCq1pap04Zw,"KARMA INSTAN‼️ DULU HINA TKI, SEKARANG WARGA MALAYSIA MALAH MENGEMIS DI NEGERI SENDIRI‼️",2026-03-09,739.0,23403.0,0:04:22,35.51,,,,,,,,0.0,0.0,7.0,4.0,220.0,6.0,97.35,12.0,242.0,0.0,0.0,,2113.729,116962.129,0.0,116962.129,210243.235,23651.0,11713.368,8889.402,17949.0,5097.819,0.0,16.0,443.0,0.0,0.0,0.0,0.0,0.0,229.0,16.3778,0.1918,1.0,1.0,0.2384,1.0,0.0,0.0,0.0,,,0.0,0.0,0.0,,0.0,0.0,0.0,,145.0,1.4,10354.0,23403.0,1705.8027,3.0,119075.858,104164.0,18.82,karma instan dulu hina
MALAYSIA PANIK‼️ INDONESIA BANGKIT DI BORNEO... (Shorts),2026-03-09,19.0,malaysia panik indonesia bangkit,2026-03-09|malaysia panik indonesia bangkit,eSbLb-EoZYw,"MALAYSIA PANIK‼️ INDONESIA BANGKIT DI BORNEO, SABAH-SARAWAK TERKEJUT KEMAJUAN IKN",2026-03-09,122.0,3287.0,0:01:37,79.67,84.59,,,,,,,0.0,0.0,0.0,0.0,102.0,6.0,94.44,2.0,5.0,0.0,0.0,,13.657,0.0,0.0,0.0,,,,,,328.83,0.0,1.0,1920.0,0.0,0.0,0.0,0.0,0.0,29.0,0.6416,,,,,0.0,,,0.0,,,0.0,0.0,0.0,,0.0,0.0,0.0,,0.0,,0.0,5374.0,89.0041,0.0,1006.235,16353.0,8.04,malaysia panik indonesia bangkit
BAGAIMANA JIKA MALAYSIA NEKAT AJAK PERANG⁉️...,2026-03-09,16.42,bagaimana jika malaysia nekat,2026-03-09|bagaimana jika malaysia nekat,eSbLb-EoZYw,BAGAIMANA JIKA MALAYSIA NEKAT AJAK PERANG⁉️ INDONESIA SIAP RATAKAN DALAM HITUNGAN JAM‼️,2026-03-09,540.0,2715.0,0:03:40,40.84,,,,,,,,0.0,0.0,0.0,0.0,38.0,3.0,92.68,1.0,46.0,0.0,0.0,,50.355,15092.819,0.0,15092.819,27459.203,2895.0,11249.161,9485.044,2441.0,5581.448,0.0,0.0,0.0,0.0,0.0,0.0,0.0,0.0,7.0,0.4852,,,,0.1829,0.0,0.0,0.0,0.0,,,0.0,0.0,0.0,,0.0,0.0,0.0,,42.0,3.21,1310.0,2715.0,166.3248,0.0,15143.174,12828.0,17.15,bagaimana jika malaysia nekat
IRAN MENGAMUK‼️ SITUS NUKLIR DAN JET TEMPUR...,2026-03-09,10.15,iran mengamuk situs nuklir,2026-03-09|iran mengamuk situs nuklir,IqPnC9CWTqA,IRAN MENGAMUK‼️ SITUS NUKLIR DAN JET TEMPUR ISRAEL JADI SASARAN EMPUK IRAN‼️,2026-03-09,510.0,4676.0,0:04:07,48.61,,,,,,,,0.0,0.0,1.0,1.0,72.0,0.0,100.0,3.0,11.0,0.0,0.0,,328.764,32381.568,0.0,32381.568,58908.608,5838.0,12252.206,10090.546,4808.0,7019.444,0.0,0.0,55.0,0.0,0.0,0.0,0.0,0.0,35.0,2.8138,,,,0.1749,11.0,0.0,1.0,0.0,,,0.0,0.0,0.0,,0.0,0.0,0.0,,89.0,2.5,3566.0,4676.0,322.0333,0.0,32710.332,13839.0,24.94,iran mengamuk situs nuklir
DPR MALAYSIA KISRUH‼️ SABAH SARAWAK INGIN LEPAS...,2026-03-11,16.15,dpr malaysia kisruh sabah,2026-03-11|dpr malaysia kisruh sabah,G7Y59qMhELs,DPR MALAYSIA KISRUH‼️ SABAH SARAWAK INGIN LEPAS ‼️ WARGANYA LAWAN RAJA PAKAI BHS INDONESIA ⁉️,2026-03-11,540.0,2805.0,0:03:49,42.46,,,,,,,,0.0,0.0,0.0,1.0,52.0,1.0,98.11,3.0,10.0,0.0,0.0,,281.144,21511.658,0.0,21511.658,39133.476,3404.0,14142.926,11496.321,2767.0,7768.331,0.0,0.0,0.0,0.0,0.0,0.0,0.0,0.0,19.0,1.6786,,,,0.1832,0.0,0.0,0.0,0.0,,,0.0,0.0,0.0,,0.0,0.0,0.0,,41.0,2.44,1679.0,2805.0,178.6478,-1.0,21792.802,12867.0,17.74,dpr malaysia kisruh sabah
CINDO SURABAYA BIKIN IRI‼️ DI MALAYSIA TAK MAU...,2026-03-11,18.15,cindo surabaya bikin iri,2026-03-11|cindo surabaya bikin iri,wuWTelUxz2A,"CINDO SURABAYA BIKIN IRI‼️ DI MALAYSIA TAK MAU BAHASA MELAYU, DI INDONESIA MEDOK BAHASA DAERAH",2026-03-11,540.0,166910.0,0:02:21,26.27,,,,,,,,1.0,80.0,87.0,0.0,944.0,19.0,98.03,19.0,245.0,0.0,0.0,,19174.785,597119.224,0.0,597119.224,1085879.056,103184.0,13418.836,10523.715,80922.0,3670.286,0.0,0.0,0.0,0.0,0.0,0.0,0.0,0.0,2809.0,144.406,,,,0.1833,2.0,0.0,0.0,0.0,,,0.0,0.0,0.0,,0.0,0.0,0.0,,0.0,,0.0,166910.0,6577.8695,87.0,616294.008,1728315.0,9.01,cindo surabaya bikin iri
MALAYSIA-SINGAPURA LUMPUH‼️ SELAT HORMUZ DITUTUP...,2026-03-12,7.15,malaysia singapura lumpuh selat,2026-03-12|malaysia singapura lumpuh selat,G7Y59qMhELs,MALAYSIA-SINGAPURA LUMPUH‼️ SELAT HORMUZ DITUTUP HARGA MINYAK MELEDAK‼️ PRABOWO STOP EKSPOR GAS‼️,2026-03-12,600.0,9712.0,0:04:26,44.38,,,,,,,,0.0,0.0,8.0,4.0,157.0,3.0,98.13,8.0,49.0,0.0,0.0,,457.491,64781.518,0.0,64781.518,117853.586,12526.0,12013.617,9408.717,9810.0,6717.103,0.0,0.0,0.0,0.0,0.0,0.0,0.0,0.0,58.0,4.2101,,,,0.1998,4.0,1.0,0.0,0.0,,,0.0,0.0,0.0,,0.0,0.0,0.0,,97.0,1.52,6400.0,9712.0,718.3623,4.0,65239.009,45226.0,18.49,malaysia singapura lumpuh selat
MALAYSIA DIKUASAI ASING‼️ DULU HINA TKI‼️...,2026-03-12,10.15,malaysia dikuasai asing dulu,2026-03-12|malaysia dikuasai asing dulu,TXRz55DGwGA,MALAYSIA DIKUASAI ASING‼️ DULU HINA TKI‼️ KINI MENANGIS WARGA LOKAL TERSINGKIRKAN,2026-03-12,600.0,9953.0,0:03:46,37.74,,,,,,,,0.0,0.0,12.0,5.0,111.0,4.0,96.52,0.0,66.0,0.0,0.0,,134.755,50214.746,0.0,50214.746,91369.706,11846.0,9179.195,7713.127,9954.0,5112.21,0.0,0.0,0.0,0.0,0.0,0.0,0.0,0.0,29.0,1.5722,,,,0.1998,4.0,0.0,0.0,0.0,,,0.0,0.0,0.0,,0.0,0.0,0.0,,56.0,1.54,3643.0,9953.0,626.125,7.0,50349.501,69219.0,12.92,malaysia dikuasai asing dulu
MALAYSIA TERANCAM HANCUR‼️ SABAH-SARAWAH SIAP MERDEKA⁉️...,2026-03-12,13.15,malaysia terancam hancur sabah,2026-03-12|malaysia terancam hancur sabah,YSuITnRVM3c,MALAYSIA TERANCAM HANCUR‼️ SABAH-SARAWAH SIAP MERDEKA⁉️ PRABOWO KERAHKAN MILITER DI PERBATASAN,2026-03-12,600.0,4524.0,0:03:44,37.48,,,,,,,,0.0,0.0,1.0,2.0,93.0,3.0,96.88,5.0,7.0,0.0,0.0,,222.264,30377.66,0.0,30377.66,55265.048,5779.0,11463.399,9563.082,4821.0,6768.125,0.0,0.0,0.0,0.0,0.0,0.0,0.0,0.0,28.0,2.0527,,,,0.1999,7.0,0.0,1.0,0.0,,,0.0,0.0,0.0,,0.0,0.0,0.0,,39.0,1.93,2022.0,4524.0,282.622,-1.0,30599.924,20802.0,17.36,malaysia terancam hancur sabah
"KARMA INSTAN‼️ DULU HINA TKI, SEKARANG WARGA MALAYSIA... (Shorts)",2026-03-12,19.01,karma instan dulu hina,2026-03-12|karma instan dulu hina,wuWTelUxz2A,"KARMA INSTAN‼️ DULU HINA TKI, SEKARANG WARGA MALAYSIA MALAH MENGEMIS DI NEGERI SENDIRI‼️",2026-03-12,116.0,3259.0,0:01:27,75.37,79.7,,,,,,,0.0,0.0,3.0,0.0,101.0,3.0,97.12,1.0,21.0,0.0,0.0,,11.656,0.0,0.0,0.0,,,,,,334.168,0.0,2.0,1446.0,0.0,0.0,0.0,0.0,0.0,18.0,0.2738,,,,,0.0,,,0.0,,,0.0,0.0,0.0,,0.0,0.0,0.0,,0.0,,0.0,5704.0,79.5579,3.0,1088.97,5176.0,5.24,karma instan dulu hina
"HEBOH‼️ KECANDUAN PRODUK RI, WARGA MALAYSIA RAMAI-RAMAI...",2026-03-12,20.15,heboh kecanduan produk ri,2026-03-12|heboh kecanduan produk ri,GlqGFLzfRGU,"HEBOH‼️ KECANDUAN PRODUK RI, WARGA MALAYSIA RAMAI-RAMAI KE JAKARTA BELANJA LEBARAN",2026-03-12,601.0,6284.0,0:03:40,36.63,,,,,,,,1.0,80.0,7.0,1.0,116.0,0.0,100.0,1.0,19.0,0.0,0.0,,421.8,23994.975,0.0,23994.975,43665.12,5904.0,8934.954,7395.854,4887.0,3928.824,0.0,48.0,4214.0,0.0,0.0,0.0,0.0,0.0,68.0,3.5982,,,,0.2001,6.0,0.0,0.0,0.0,,,0.0,0.0,0.0,,0.0,0.0,0.0,,27.0,1.19,2274.0,6284.0,384.292,6.0,24416.775,43360.0,12.57,heboh kecanduan produk ri
"JET AS TERBAKAR‼️ MARKAS IDF RATA, ISRAEL HANCUR LEBUR...",2026-03-14,7.15,jet as terbakar markas,2026-03-14|jet as terbakar markas,ttAcZieoK1k,"JET AS TERBAKAR‼️ MARKAS IDF RATA, ISRAEL HANCUR LEBUR NETANYAHU PANIK SIAP LUNCURKAN NUKLIR⁉️",2026-03-14,630.0,7679.0,0:04:45,45.32,,,,,,,,1.0,80.0,6.0,6.0,197.0,2.0,98.99,12.0,51.0,0.0,0.0,,939.544,59525.352,0.0,59525.352,108282.552,10070.0,14652.578,10752.984,7390.0,7882.336,0.0,0.0,0.0,0.0,0.0,0.0,0.0,0.0,77.0,6.9307,,,,0.2081,4.0,0.0,0.0,0.0,,,0.0,0.0,0.0,,0.0,0.0,0.0,,90.0,1.69,5312.0,7679.0,608.9695,0.0,60464.896,23615.0,26.8,jet as terbakar markas
