PUTIN BEKINGI PRABOWO BANGUN KAPAL INDUK...,2026-02-01,20.15,putin bekingi prabowo bangun,2026-02-01|putin bekingi prabowo bangun,EH3oRPQOHhY,"PUTIN BEKINGI PRABOWO BANGUN KAPAL INDUK CANGGIH, MALAYSIA CEMAS POSISINYA TERANCAM!",2026-02-01,506.0,7051.0,0:03:42,43.95,,,,,,,,0.0,0.0,5.0,1.0,188.0,3.0,98.43,6.0,41.0,0.0,0.0,,210.306,22929.047,0.0,22929.047,41721.796,5423.0,8432.053,7693.49,4948.0,3301.996,0.0,5.0,100.0,0.0,0.0,0.0,0.0,0.0,28.0,1.2936,,,,0.1738,16.0,0.0,0.0,0.0,,,0.0,0.0,0.0,,0.0,0.0,0.0,,94.0,2.49,3775.0,7051.0,435.5787,4.0,23139.353,35665.0,15.31,putin bekingi prabowo bangun
BARU DIPAMERKAN AUTO KEPINCUT! ARAB SAUDI BORONG...,2026-02-02,7.15,baru dipamerkan auto kepincut,2026-02-02|baru dipamerkan auto kepincut,1X88piKFEO4,"BARU DIPAMERKAN AUTO KEPINCUT! ARAB SAUDI BORONG 1000 BUS RI, BUS MEWAH INDONESIA BIKIN DUNIA SYOK!",2026-02-02,546.0,4378.0,0:03:00,33.13,,,,,,,,1.0,80.0,3.0,2.0,77.0,1.0,98.72,10.0,9.0,0.0,0.0,,218.835,11670.267,0.0,11670.267,21235.191,2568.0,9301.442,8269.155,2283.0,2729.135,0.0,2.0,8.0,0.0,0.0,0.0,0.0,0.0,28.0,1.5416,,,,185.0,6.0,0.0,0.0,0.0,,,0.0,0.0,0.0,,0.0,0.0,0.0,,33.0,3.48,948.0,4378.0,219.9849,1.0,11889.103,23067.0,14.5,baru dipamerkan auto kepincut
TIMOR LESTE & AUSTRALIA TINGGALKAN BAHASA MELAYU...,2026-02-02,13.15,timor leste australia tinggalkan,2026-02-02|timor leste australia tinggalkan,AiGbZ0hQq9Q,"TIMOR LESTE & AUSTRALIA TINGGALKAN BAHASA MELAYU, LEBIH NYAMAN PAKAI BAHASA INDONESIA",2026-02-02,600.0,16405.0,0:03:35,35.92,,,,,,,,3.0,240.0,11.0,6.0,155.0,2.0,98.73,5.0,65.0,0.0,0.0,,1574.06,52442.91,0.0,52442.91,95414.428,10817.0,10237.6,8820.785,9320.0,3300.791,0.0,0.0,3.0,0.0,0.0,0.0,0.0,0.0,191.0,10.0217,0.2825,4.0,1.0,0.1999,7.0,0.0,0.0,0.0,,,0.0,0.0,0.0,,0.0,0.0,0.0,,71.0,1.37,5177.0,16405.0,982.0438,5.0,54016.97,101016.0,12.44,timor leste australia tinggalkan
PUTIN BEKINGI PRABOWO BANGUN KAPAL INDUK... (Shorts),2026-02-02,17.15,putin bekingi prabowo bangun,2026-02-02|putin bekingi prabowo bangun,wT5yG-63NLU,"PUTIN BEKINGI PRABOWO BANGUN KAPAL INDUK CANGGIH, MALAYSIA CEMAS POSISINYA TERANCAM!",2026-02-02,91.0,5981.0,0:01:20,88.38,82.79,,,,,,,0.0,0.0,6.0,0.0,339.0,9.0,97.41,6.0,20.0,0.0,0.0,,26.537,0.0,0.0,0.0,,,,,,267.874,0.0,3.0,4304.0,0.0,0.0,0.0,0.0,0.0,42.0,0.6275,,,,,0.0,,,0.0,,,0.0,0.0,0.0,,0.0,0.0,0.0,,0.0,,0.0,10422.0,134.0679,6.0,1703.319,24217.0,9.15,putin bekingi prabowo bangun
RUDAL KHAN TNI BIDIK SABAH & TAWAU‼️...,2026-02-03,8.15,rudal khan tni bidik,2026-02-03|rudal khan tni bidik,U9m5C2adCMg,RUDAL KHAN TNI BIDIK SABAH & TAWAU‼️ SINGAPURA PERINGATKAN MALAYSIA JANGAN NEKAT LAWAN RI,2026-02-03,510.0,4581.0,0:03:04,36.08,,,,,,,,0.0,0.0,0.0,0.0,101.0,1.0,99.02,2.0,21.0,0.0,0.0,,277.792,16239.694,0.0,16239.694,29549.557,3821.0,8575.031,7733.462,3446.0,3618.743,0.0,0.0,0.0,0.0,0.0,0.0,0.0,0.0,38.0,1.9085,,,,0.1749,0.0,0.0,0.0,0.0,,,0.0,0.0,0.0,,0.0,0.0,0.0,,0.0,,0.0,4581.0,234.1802,0.0,16517.486,14844.0,22.98,rudal khan tni bidik
KURANG AJAR‼️ TIMOR LESTE DUKUNG REFERENDUM...,2026-02-03,11.15,kurang ajar timor leste,2026-02-03|kurang ajar timor leste,9GuXKp5b60Y,"KURANG AJAR‼️ TIMOR LESTE DUKUNG REFERENDUM PAPUA, PRABOWO: JANGAN COBA-COBA USIK KEDAULATAN NKRI!",2026-02-03,600.0,13625.0,0:03:41,36.87,,,,,,,,0.0,0.0,37.0,5.0,185.0,15.0,92.5,66.0,164.0,0.0,0.0,,303.292,51677.423,0.0,51677.423,94027.874,11507.0,9105.052,8171.363,10327.0,3829.992,0.0,0.0,0.0,0.0,0.0,0.0,0.0,0.0,51.0,4.2566,0.6334,10.0,5.0,0.1998,41.0,0.0,0.0,0.0,,,0.0,0.0,0.0,,0.0,0.0,0.0,,102.0,1.61,6345.0,13625.0,837.3002,32.0,51980.714,83208.0,13.67,kurang ajar timor leste
SINGAPURA MARAH BESAR! KAPAL VIETNAM TOLAK...,2026-02-03,13.15,singapura marah besar kapal,2026-02-03|singapura marah besar kapal,dM0XmJt3PB0,"SINGAPURA MARAH BESAR! KAPAL VIETNAM TOLAK BERSANDAR DI PELABUHAN SINGAPURA, AUTO SEPERTI KUBURAN",2026-02-03,570.0,2573.0,0:03:23,35.65,,,,,,,,0.0,0.0,1.0,0.0,55.0,2.0,96.49,3.0,11.0,0.0,0.0,,209.244,20921.333,0.0,20921.333,38054.865,2616.0,16118.113,14546.967,2361.0,8218.183,0.0,0.0,0.0,0.0,0.0,0.0,0.0,0.0,23.0,1.7029,,,,0.1916,6.0,0.0,0.0,0.0,,,0.0,0.0,0.0,,0.0,0.0,0.0,,16.0,2.16,742.0,2573.0,145.2474,1.0,21130.577,11711.0,12.58,singapura marah besar kapal
MALAYSIA PUSING! WARGA PERBATASAN INGINKAN...,2026-02-03,16.15,malaysia pusing warga perbatasan,2026-02-03|malaysia pusing warga perbatasan,wT5yG-63NLU,"MALAYSIA PUSING! WARGA PERBATASAN INGINKAN GABUNG NKRI, BEGINI KEADAAN PERBATASAN INDONESIA-JIRAN",2026-02-03,600.0,3777.0,0:03:42,37.09,,,,,,,,0.0,0.0,0.0,0.0,86.0,1.0,98.85,2.0,19.0,0.0,0.0,,59.755,16467.987,0.0,16467.987,29962.548,3428.0,9891.894,8740.533,3029.0,4378.949,0.0,1.0,17.0,0.0,0.0,0.0,0.0,0.0,20.0,0.7836,,,,0.2,7.0,0.0,0.0,0.0,,,0.0,0.0,0.0,,0.0,0.0,0.0,,21.0,1.64,1280.0,3777.0,233.5078,0.0,16527.743,16771.0,17.0,malaysia pusing warga perbatasan
SAAT WARGA ASING LAIN DIUSIR & DIDEMO... (Shorts),2026-02-03,17.3,saat warga asing lain,2026-02-03|saat warga asing lain,9GuXKp5b60Y,"SAAT WARGA ASING LAIN DIUSIR & DIDEMO, INDONESIA JUSTRU DIBELA MATI-MATIAN WARGA JEPANG",2026-02-03,80.0,8717.0,0:01:10,87.75,85.73,,,,,,,0.0,0.0,3.0,0.0,255.0,17.0,93.75,16.0,6.0,0.0,0.0,,27.982,0.0,0.0,0.0,,,,,,267.205,0.0,1.0,5674.0,0.0,0.0,0.0,0.0,0.0,56.0,0.6701,,,,,0.0,,,0.0,,,0.0,0.0,0.0,,0.0,0.0,0.0,,0.0,,0.0,14498.0,170.7238,3.0,2474.711,6424.0,5.59,saat warga asing lain
KURANG AJAR‼️ MALAYSIA DESAK INDONESIA TAMPUNG...,2026-02-03,18.15,kurang ajar malaysia desak,2026-02-03|kurang ajar malaysia desak,U9m5C2adCMg,KURANG AJAR‼️ MALAYSIA DESAK INDONESIA TAMPUNG & BERIKAN PULAU UNTUK ROHINGNYA,2026-02-03,643.0,2654.0,0:03:11,29.84,,,,,,,,0.0,0.0,3.0,2.0,46.0,6.0,88.46,1.0,101.0,0.0,0.0,,52.38,8286.999,0.0,8286.999,15080.975,2214.0,7666.993,6811.642,1967.0,3146.627,0.0,0.0,0.0,0.0,0.0,0.0,0.0,0.0,18.0,0.8374,,,,0.2121,39.0,0.0,0.0,0.0,,,0.0,0.0,0.0,,0.0,0.0,0.0,,0.0,,0.0,2654.0,141.4726,1.0,8339.38,10568.0,16.03,kurang ajar malaysia desak
BIKIN HEBOH‼️ THAILAND TAK TAHAN LAGI MILIKI BUS RI...,2026-02-03,20.15,bikin heboh thailand tak,2026-02-03|bikin heboh thailand tak,P_jtexL5lBM,"BIKIN HEBOH‼️ THAILAND TAK TAHAN LAGI MILIKI BUS RI, TAK SABAR NAIK BUS MEWAH BUATAN INDONESIA",2026-02-03,509.0,21336.0,0:03:29,41.15,,,,,,,,4.0,320.0,21.0,5.0,312.0,8.0,97.5,15.0,29.0,0.0,1.0,0.0,1264.103,71847.151,0.0,71847.151,130725.573,15571.0,9767.302,8395.451,13384.0,3784.202,0.0,14.0,304.0,140182.61,1.0,7592.352,7569.847,0.0,157.0,9.4323,0.8696,9.0,2.25,0.1744,5.0,0.0,0.0,0.0,,,0.0,0.0,0.0,,0.0,0.0,0.0,,118.0,1.31,9016.0,21336.0,1241.3879,16.0,80681.102,106721.0,17.16,bikin heboh thailand tak
MALAYSIA BUBAR? RAKYAT SABAH-SARAWAK MUAK...,2026-02-04,7.15,malaysia bubar rakyat sabah,2026-02-04|malaysia bubar rakyat sabah,Nym_4KVY0Hg,"MALAYSIA BUBAR? RAKYAT SABAH-SARAWAK MUAK DIBOHONGI: ""KALAU INDONESIA NAK AMBIL, AMBILLAH!""",2026-02-04,557.0,4089.0,0:03:48,41.08,,,,,,,,0.0,0.0,0.0,0.0,103.0,0.0,100.0,2.0,41.0,0.0,0.0,,252.289,18366.919,0.0,18366.919,33418.758,3887.0,9872.602,8597.571,3385.0,4555.655,0.0,3.0,56.0,0.0,0.0,0.0,0.0,0.0,25.0,1.8154,,,,0.1878,5.0,0.0,0.0,0.0,,,0.0,0.0,0.0,,0.0,0.0,0.0,,31.0,1.55,2003.0,4089.0,259.8993,0.0,18619.208,18149.0,17.9,malaysia bubar rakyat sabah
"ESTONIA GABUNG INDONESIA, SINDIKAT GELAP...",2026-02-04,10.15,estonia gabung indonesia sindikat,2026-02-04|estonia gabung indonesia sindikat,dxKGCwZmGec,"ESTONIA GABUNG INDONESIA, SINDIKAT GELAP MALAYSIA PANIK BESAR",2026-02-04,600.0,20686.0,0:03:40,36.73,,,,,,,,0.0,0.0,16.0,8.0,432.0,4.0,99.08,19.0,60.0,0.0,0.0,,1358.004,92243.354,0.0,92243.354,167817.6,20310.0,9454.513,8262.806,17750.0,4529.812,0.0,0.0,0.0,0.0,0.0,0.0,0.0,0.0,136.0,9.8804,0.1854,4.0,1.0,0.2,9.0,0.0,0.0,0.0,,,0.0,0.0,0.0,,0.0,0.0,0.0,,48.0,0.88,5431.0,20686.0,1266.2573,8.0,93601.359,66998.0,27.33,estonia gabung indonesia sindikat
MALAYSIA NGEMIS INDONESIA MINTA TAMPUNG...,2026-02-04,13.15,malaysia ngemis indonesia minta,2026-02-04|malaysia ngemis indonesia minta,Nym_4KVY0Hg,MALAYSIA NGEMIS INDONESIA MINTA TAMPUNG WARGA BANGLADESH & ROHINGNYA DI JAWA,2026-02-04,540.0,5073.0,0:04:06,45.68,,,,,,,,0.0,0.0,0.0,1.0,72.0,2.0,97.3,8.0,161.0,0.0,0.0,,340.296,24408.697,0.0,24408.697,44406.858,4712.0,11331.171,9424.206,3919.0,4879.949,0.0,0.0,36.0,0.0,0.0,0.0,0.0,0.0,53.0,3.4874,,,,0.1832,4.0,0.0,1.0,0.0,,,0.0,0.0,0.0,,0.0,0.0,0.0,,38.0,1.11,3418.0,5073.0,347.6072,-1.0,24748.993,18175.0,22.89,malaysia ngemis indonesia minta
BIKIN HEBOH‼️ THAILAND TAK TAHAN LAGI... (Shorts),2026-02-04,17.01,bikin heboh thailand tak,2026-02-04|bikin heboh thailand tak,bavc9C6zEyI,"BIKIN HEBOH‼️ THAILAND TAK TAHAN LAGI MILIKI BUS RI, TAK SABAR NAIK BUS MEWAH BUATAN INDONESIA",2026-02-04,113.0,4096.0,0:01:17,68.75,81.12,,,,,,,0.0,0.0,1.0,0.0,204.0,7.0,96.68,1.0,6.0,0.0,0.0,,23.264,0.0,0.0,0.0,,,,,,275.553,0.0,1.0,2608.0,0.0,0.0,0.0,0.0,0.0,37.0,0.4551,,,,,0.0,,,0.0,,,0.0,0.0,0.0,,0.0,0.0,0.0,,0.0,,0.0,6713.0,88.8422,1.0,1184.706,11725.0,8.27,bikin heboh thailand tak
GEMPAR! TENTARA MALAYSIA PAMER F-35...,2026-02-04,18.15,gempar tentara malaysia pamer,2026-02-04|gempar tentara malaysia pamer,dxKGCwZmGec,"GEMPAR! TENTARA MALAYSIA PAMER F-35, PESAWAT SILUMAN RI MENYELUSUP TANPA TERDETEKSI RADAR JIRAN‼",2026-02-04,530.0,2594.0,0:03:52,43.78,,,,,,,,0.0,0.0,0.0,1.0,67.0,3.0,95.71,0.0,39.0,0.0,0.0,,125.232,13276.374,0.0,13276.374,24152.948,2362.0,11176.746,10225.634,2161.0,5168.379,0.0,1.0,65.0,0.0,0.0,0.0,0.0,0.0,20.0,1.2646,,,,0.1805,13.0,1.0,0.0,0.0,,,0.0,0.0,0.0,,0.0,0.0,0.0,,15.0,1.28,1174.0,2594.0,167.1827,-1.0,13401.606,12302.0,12.44,gempar tentara malaysia pamer
NEGARA PALING TAK TAU DIRI! MINTA MERDEKA...,2026-02-04,20.15,negara paling tak tau,2026-02-04|negara paling tak tau,bavc9C6zEyI,"NEGARA PALING TAK TAU DIRI! MINTA MERDEKA TAPI JADI BENALU, MINYAK & MAKANAN MASIH MINTA INDONESIA!",2026-02-04,604.0,7928.0,0:03:55,38.96,,,,,,,,3.0,240.0,2.0,2.0,172.0,5.0,97.18,8.0,109.0,0.0,0.0,,786.073,37950.559,0.0,37950.559,69039.537,7221.0,11247.888,9560.939,6138.0,4884.404,0.0,4.0,131.0,0.0,0.0,0.0,0.0,0.0,78.0,6.013,0.7785,11.0,1.8333,0.2009,15.0,0.0,0.0,0.0,,,0.0,0.0,0.0,,0.0,0.0,0.0,,49.0,1.19,4134.0,7928.0,518.2341,0.0,38736.632,33686.0,18.48,negara paling tak tau
"JANGAN NGAKAK! DIKLAIM MALAYSIA, INILAH...",2026-02-05,7.3,jangan ngakak diklaim malaysia,2026-02-05|jangan ngakak diklaim malaysia,k2HXHNZifJU,"JANGAN NGAKAK! DIKLAIM MALAYSIA, INILAH PERBEDAAN KUDA KEPANG INDONESIA VS MALAYSIA LUCU KAYAK KODOK",2026-02-05,540.0,3289.0,0:03:27,38.42,,,,,,,,0.0,0.0,2.0,0.0,49.0,3.0,94.23,1.0,34.0,0.0,0.0,,116.283,7622.35,0.0,7622.35,13872.224,2029.0,7685.443,6836.976,1805.0,2354.212,0.0,0.0,23.0,0.0,0.0,0.0,0.0,0.0,16.0,901.0,,,,0.1831,11.0,0.0,0.0,0.0,,,0.0,0.0,0.0,,0.0,0.0,0.0,,16.0,1.75,912.0,3289.0,189.5403,2.0,7738.633,21822.0,11.45,jangan ngakak diklaim malaysia
HEBOH! INDIA JIPLAK BUS INDONESIA...,2026-02-05,13.15,heboh india jiplak bus,2026-02-05|heboh india jiplak bus,_h1RKXBFNWg,"HEBOH! INDIA JIPLAK BUS INDONESIA, KAROSERI RI JADI PRIMADONA DIPESAN BANYAK NEGARA MAJU",2026-02-05,600.0,3024.0,0:03:11,31.86,,,,,,,,1.0,80.0,0.0,0.0,41.0,1.0,97.62,3.0,4.0,0.0,0.0,,287.759,13285.208,0.0,13285.208,24171.189,2540.0,10638.728,9516.216,2272.0,4488.468,0.0,0.0,24.0,0.0,0.0,0.0,0.0,0.0,20.0,1.609,,,,0.2,5.0,0.0,0.0,0.0,,,0.0,0.0,0.0,,0.0,0.0,0.0,,18.0,1.84,979.0,3024.0,160.5515,0.0,13572.966,12691.0,14.03,heboh india jiplak bus
MEMANAS! MALAYSIA PANIK BESAR SABAH SARAWAK...,2026-02-05,16.15,memanas malaysia panik besar,2026-02-05|memanas malaysia panik besar,rAq6RcWORNI,MEMANAS! MALAYSIA PANIK BESAR SABAH SARAWAK GABUNG INDONESIA,2026-02-05,600.0,4696.0,0:04:22,43.76,,,,,,,,0.0,0.0,1.0,1.0,104.0,2.0,98.11,6.0,38.0,0.0,0.0,,543.546,23499.369,0.0,23499.369,42752.541,4550.0,11052.88,9396.163,3868.0,5119.699,0.0,0.0,0.0,0.0,0.0,0.0,0.0,0.0,44.0,3.513,,,,0.2,2.0,0.0,0.0,0.0,,,0.0,0.0,0.0,,0.0,0.0,0.0,,39.0,1.36,2871.0,4696.0,342.4806,0.0,24042.915,22290.0,17.12,memanas malaysia panik besar
KURANG AJAR! AUSTRALIA USIK PULAU PASIR...,2026-02-05,18.15,kurang ajar australia usik,2026-02-05|kurang ajar australia usik,MXWaLd99yu8,"KURANG AJAR! AUSTRALIA USIK PULAU PASIR, INDONESIA AUTO STOP EKSPOR PUPUK KE AUSTRALIA",2026-02-05,504.0,4837.0,0:03:34,42.57,,,,,,,,0.0,0.0,3.0,1.0,109.0,3.0,97.32,3.0,34.0,0.0,0.0,,288.458,23114.542,0.0,23114.542,42052.475,4364.0,10860.66,9636.223,3872.0,4838.954,0.0,0.0,55.0,0.0,0.0,0.0,0.0,0.0,40.0,2.0825,,,,0.1731,12.0,0.0,0.0,0.0,,,0.0,0.0,0.0,,0.0,0.0,0.0,,56.0,3.17,1768.0,4837.0,288.3041,2.0,23402.999,20426.0,17.67,kurang ajar australia usik
"PROJECT GILA PRABOWO RP 1300 T, BIKIN JIRAN ASEAN MELONGO",2026-02-06,7.15,project gila prabowo rp,2026-02-06|project gila prabowo rp,RPysxs81x7o,"PROJECT GILA PRABOWO RP 1300 T, BIKIN JIRAN ASEAN MELONGO",2026-02-06,563.0,7061.0,0:03:15,34.67,,,,,,,,0.0,0.0,2.0,2.0,120.0,3.0,97.56,16.0,28.0,0.0,0.0,,557.575,36706.001,0.0,36706.001,66777.678,6657.0,11495.555,10031.197,5809.0,5277.941,0.0,0.0,0.0,0.0,0.0,0.0,0.0,0.0,50.0,3.0156,,,,0.1895,19.0,0.0,0.0,0.0,,,0.0,0.0,0.0,,0.0,0.0,0.0,,36.0,2.21,1629.0,7061.0,382.8697,0.0,37263.576,25212.0,21.64,project gila prabowo rp
MALAYSIA PANIK AKIBAT CARI GARA-GARA... ,2026-02-06,13.15,malaysia panik akibat cari,2026-02-06|malaysia panik akibat cari,zgTN3GH9BCg,MALAYSIA PANIK AKIBAT CARI GARA-GARA ANCAM & REMEHKAN TNI! MELAYAN IKAN DITANGKAP,2026-02-06,480.0,5503.0,0:03:06,38.95,,,,,,,,0.0,0.0,2.0,3.0,117.0,4.0,96.69,3.0,71.0,0.0,0.0,,251.039,23904.23,0.0,23904.23,43491.052,4866.0,10130.69,8937.742,4293.0,4391.297,0.0,0.0,0.0,0.0,0.0,0.0,0.0,0.0,41.0,1.8029,,,,0.1669,3.0,0.0,0.0,0.0,,,0.0,0.0,0.0,,0.0,0.0,0.0,,74.0,3.73,1982.0,5503.0,285.7878,-1.0,24155.27,19511.0,21.17,malaysia panik akibat cari
JIRAN GELISAH! SIMULASI PERANG BESAR-BESARAN... ,2026-02-06,16.15,jiran gelisah simulasi perang,2026-02-06|jiran gelisah simulasi perang,JSmlfvU6LAg,JIRAN GELISAH! SIMULASI PERANG BESAR-BESARAN RIBUAN KOPASGAT & ALUTSISTA DIKERAHKAN,2026-02-06,480.0,4638.0,0:03:07,39.1,,,,,,,,0.0,0.0,3.0,3.0,108.0,2.0,98.18,4.0,25.0,0.0,0.0,,282.852,17131.473,0.0,17131.473,32771.185,3703.0,9903.652,8849.901,3309.0,3754.493,0.0,0.0,0.0,0.0,0.0,0.0,0.0,0.0,30.0,1.9057,,,,0.1666,5.0,0.0,0.0,0.0,,,0.0,0.0,0.0,,0.0,0.0,0.0,,36.0,1.73,2081.0,4638.0,241.7823,0.0,17414.325,19117.0,18.54,jiran gelisah simulasi perang
NEGARA PALING TAK TAU DIRI! (Shorts),2026-02-06,17.01,negara paling tak tau,2026-02-06|negara paling tak tau,kxhITA7IYvk,"NEGARA PALING TAK TAU DIRI! MINTA MERDEKA TAPI JADI BENALU, MINYAK & MAKANAN MASIH MINTA INDONESIA!",2026-02-06,107.0,3881.0,0:01:35,89.18,88.21,,,,,,,0.0,0.0,2.0,0.0,163.0,8.0,95.32,7.0,33.0,0.0,0.0,,19.121,0.0,0.0,0.0,,,,,,269.949,0.0,3.0,2533.0,0.0,0.0,0.0,0.0,0.0,33.0,0.4917,,,,,0.0,,,0.0,,,0.0,0.0,0.0,,0.0,0.0,0.0,,0.0,,0.0,6460.0,103.0685,2.0,1102.569,25980.0,8.63,negara paling tak tau
MALAYSIA GAGAL NIRU! PTDI GANDENG HONEYWELL... ,2026-02-06,20.15,malaysia gagal niru ptdi,2026-02-06|malaysia gagal niru ptdi,JSmlfvU6LAg,"MALAYSIA GAGAL NIRU! PTDI GANDENG HONEYWELL SIAP PRODUKSI BESAR-BESARAN NC212i, CN235, DAN N219",2026-02-06,501.0,9410.0,0:03:43,44.66,,,,,,,,1.0,80.0,1.0,1.0,180.0,2.0,98.9,7.0,39.0,0.0,0.0,,1070.571,54310.289,0.0,54310.289,98793.465,7846.0,14824.95,12591.571,6664.0,5884.321,0.0,0.0,0.0,0.0,0.0,0.0,0.0,0.0,108.0,7.0915,,,,0.1724,12.0,0.0,0.0,0.0,,,0.0,0.0,0.0,,0.0,0.0,0.0,,60.0,1.24,4851.0,9410.0,584.8581,0.0,55380.86,54373.0,14.21,malaysia gagal niru ptdi
MEDIA ASING HEBOH! RAFALE RI SIAP DUEL DI UDARA...,2026-02-07,7.3,media asing heboh rafale,2026-02-07|media asing heboh rafale,bxfElTj9u2w,"MEDIA ASING HEBOH! RAFALE RI SIAP DUEL DI UDARA, MALAYSIA-VIETNAM WASPADA!",2026-02-07,480.0,3406.0,0:03:44,46.74,,,,,,,,0.0,0.0,3.0,3.0,102.0,2.0,98.08,6.0,21.0,0.0,0.0,,91.636,16275.515,0.0,16275.515,29610.341,2951.0,10938.434,10034.002,2707.0,4808.721,0.0,0.0,0.0,0.0,0.0,0.0,0.0,0.0,17.0,1.0836,,,,0.1666,6.0,0.0,0.0,0.0,,,0.0,0.0,0.0,,0.0,0.0,0.0,,26.0,1.79,1452.0,3406.0,212.255,0.0,16367.151,13880.0,16.37,media asing heboh rafale
DPR MALAYSIA RICUH! PM ANWAR SERAHKAN WILAYAH...,2026-02-07,13.15,dpr malaysia ricuh pm,2026-02-07|dpr malaysia ricuh pm,kxhITA7IYvk,"DPR MALAYSIA RICUH! PM ANWAR SERAHKAN WILAYAH KE INDONESIA, DPR TAK TERIMA PMX BERKHIANAT",2026-02-07,671.0,2733.0,0:04:12,37.68,,,,,,,,0.0,0.0,1.0,0.0,47.0,2.0,95.92,3.0,16.0,0.0,0.0,,135.095,13391.99,0.0,13391.99,24368.293,2892.0,9901.785,8426.104,2461.0,4948.339,0.0,0.0,21.0,0.0,0.0,0.0,0.0,0.0,22.0,1.4582,,,,0.2195,7.0,0.0,0.0,0.0,,,0.0,0.0,0.0,,0.0,0.0,0.0,,5.0,1.3,386.0,2733.0,191.9608,1.0,13527.085,14134.0,14.14,dpr malaysia ricuh pm
THAILAND BUNGKAM NETIZEN MALAYSIA...,2026-02-07,16.15,thailand bungkam netizen malaysia,2026-02-07|thailand bungkam netizen malaysia,WcTNW5lkK9w,THAILAND BUNGKAM NETIZEN MALAYSIA YANG HOBI NYINYIR KE INDONESIA,2026-02-07,480.0,8145.0,0:02:42,33.88,,,,,,,,0.0,0.0,7.0,1.0,116.0,1.0,99.15,3.0,30.0,0.0,0.0,,766.671,26000.328,0.0,26000.328,47301.824,4821.0,11486.601,9811.621,4118.0,3286.327,0.0,2.0,75.0,0.0,0.0,0.0,0.0,0.0,118.0,4.8236,,,,0.1666,11.0,0.0,0.0,0.0,,,0.0,0.0,0.0,,0.0,0.0,0.0,,42.0,1.9,2210.0,8145.0,367.949,6.0,26766.999,41212.0,13.7,thailand bungkam netizen malaysia
MALAYSIA GAGAL NIRU! PTDI GANDENG... (Shorts),2026-02-07,17.0,malaysia gagal niru ptdi,2026-02-07|malaysia gagal niru ptdi,SV2qKxOpuV0,"MALAYSIA GAGAL NIRU! PTDI GANDENG HONEYWELL SIAP PRODUKSI BESAR-BESARAN NC212i, CN235, DAN N219",2026-02-07,96.0,4180.0,0:01:29,93.4,85.9,,,,,,,0.0,0.0,1.0,0.0,164.0,8.0,95.35,2.0,10.0,0.0,0.0,,28.672,0.0,0.0,0.0,,,,,,274.411,0.0,3.0,2540.0,0.0,0.0,0.0,0.0,0.0,42.0,2.9134,,,,,0.0,,,0.0,,,0.0,0.0,0.0,,0.0,0.0,0.0,,0.0,,0.0,7058.0,104.3878,1.0,1147.057,16958.0,9.04,malaysia gagal niru ptdi
PRABOWO MURKA! TNI KEPUNG PERBATASAN...,2026-02-08,7.15,prabowo murka tni kepung,2026-02-08|prabowo murka tni kepung,NAN6_G6u4Gw,"PRABOWO MURKA! TNI KEPUNG PERBATASAN, MALAYSIA GEMETAR LIHAT NYALI TNI",2026-02-08,630.0,3948.0,0:03:51,36.8,,,,,,,,0.0,0.0,0.0,0.0,83.0,6.0,93.26,8.0,22.0,0.0,0.0,,217.682,22494.861,0.0,22494.861,40924.164,4282.0,10916.021,9557.255,3749.0,5754.377,0.0,0.0,0.0,0.0,0.0,0.0,0.0,0.0,32.0,1.8907,,,,0.2082,18.0,0.0,0.0,0.0,,,0.0,0.0,0.0,,0.0,0.0,0.0,,33.0,2.67,1238.0,3948.0,254.2676,0.0,22712.543,16486.0,16.58,prabowo murka tni kepung
RI BANGUN MEGAPORT TERBESAR DI SELAT MALAKA...,2026-02-08,11.3,ri bangun megaport terbesar,2026-02-08|ri bangun megaport terbesar,NAN6_G6u4Gw,"RI BANGUN MEGAPORT TERBESAR DI SELAT MALAKA, BRICS DUKUNG PENUH SINGAPURA DIAMBANG RUNTUH",2026-02-08,490.0,4198.0,0:03:33,43.64,,,,,,,,0.0,0.0,1.0,1.0,72.0,3.0,96.0,3.0,7.0,0.0,0.0,,210.649,18312.963,0.0,18312.963,33320.886,4012.0,9506.672,8305.306,3505.0,4412.801,0.0,3.0,68.0,0.0,0.0,0.0,0.0,0.0,26.0,1.7908,,,,0.1693,1.0,0.0,0.0,0.0,,,0.0,0.0,0.0,,0.0,0.0,0.0,,67.0,3.8,1763.0,4198.0,249.3849,0.0,18523.612,19704.0,16.08,ri bangun megaport terbesar
TIMOR LESTE MENYESAL DIBODOHI... (Shorts),2026-02-08,17.15,timor leste menyesal dibodohi,2026-02-08|timor leste menyesal dibodohi,qDVyL4HEhOM,TIMOR LESTE MENYESAL DIBODOHI AUSTRALIA MINYAK DIKURAS HABIS NEGARA BUNTUNG!,2026-02-08,119.0,3545.0,0:01:30,76.28,86.26,,,,,,,0.0,0.0,2.0,0.0,134.0,7.0,95.04,4.0,39.0,0.0,0.0,,27.267,0.0,0.0,0.0,,,,,,278.787,0.0,0.0,2208.0,0.0,0.0,0.0,0.0,0.0,35.0,0.5778,,,,,0.0,,,0.0,,,0.0,0.0,0.0,,0.0,0.0,0.0,,0.0,,0.0,5740.0,89.5951,2.0,988.115,18118.0,9.52,timor leste menyesal dibodohi
"SERBIA GABUNG INDONESIA, MARINIR TNI AL...",2026-02-08,18.15,serbia gabung indonesia marinir,2026-02-08|serbia gabung indonesia marinir,n62K0CJmwnc,"SERBIA GABUNG INDONESIA, MARINIR TNI AL BORONG AMUNISI, JIRAN SYOK LIHAT DAYA GEMPUR KITA",2026-02-08,510.0,20056.0,0:03:37,42.6,,,,,,,,0.0,0.0,25.0,6.0,339.0,5.0,98.55,8.0,37.0,0.0,0.0,,1002.012,69664.312,0.0,69664.312,126762.843,17121.0,8550.613,7403.939,14825.0,3523.964,0.0,12.0,242.0,0.0,0.0,0.0,0.0,0.0,88.0,6.1683,0.0,1.0,1.0,0.1749,11.0,0.0,0.0,0.0,,,0.0,0.0,0.0,,0.0,0.0,0.0,,159.0,2.85,5576.0,20056.0,1210.4225,19.0,70666.324,89107.0,18.92,serbia gabung indonesia marinir
DUEL MAUT ASEAN! M-346 RI VS FA-50 MALAYSIA...,2026-02-08,20.15,duel maut asean m,2026-02-08|duel maut asean m,6nhpwInhusw,"DUEL MAUT ASEAN! M-346 RI VS FA-50 MALAYSIA, SIAPA PALING KUAT & PALING CUPU",2026-02-08,552.0,3695.0,0:03:41,40.04,,,,,,,,1.0,80.0,3.0,2.0,77.0,2.0,97.47,2.0,13.0,0.0,0.0,,173.071,18046.389,0.0,18046.389,32831.112,3270.0,11667.062,10040.095,2814.0,4933.507,0.0,0.0,0.0,0.0,0.0,0.0,0.0,0.0,21.0,1.1945,,,,0.1864,9.0,0.0,0.0,0.0,,,0.0,0.0,0.0,,0.0,0.0,0.0,,53.0,2.85,1857.0,3695.0,226.8712,1.0,18219.46,16060.0,14.65,duel maut asean m
MALAYSIA GELISAH! INDONESIA-AUSTRALIA BERSATU...,2026-02-09,7.15,malaysia gelisah indonesia australia,2026-02-09|malaysia gelisah indonesia australia,EfJWN1yNCa8,"MALAYSIA GELISAH! INDONESIA-AUSTRALIA BERSATU, BERANI SENGGOL RI, AUSTRALIA BALAS SETIMPAL",2026-02-09,599.0,4969.0,0:03:40,36.75,,,,,,,,0.0,0.0,2.0,3.0,112.0,1.0,99.12,2.0,41.0,0.0,0.0,,199.188,29882.194,0.0,29882.194,54361.298,5378.0,11430.046,10108.088,4756.0,6055.039,0.0,0.0,0.0,0.0,0.0,0.0,0.0,0.0,24.0,1.7339,,,,0.1997,7.0,0.0,0.0,0.0,,,0.0,0.0,0.0,,0.0,0.0,0.0,,23.0,1.75,1318.0,4969.0,303.8623,-1.0,30081.382,18593.0,20.37,malaysia gelisah indonesia australia
MALAYSIA MAKIN NEKAT! PRABOWO TURUN TANGAN...,2026-02-09,14.15,malaysia makin nekat prabowo,2026-02-09|malaysia makin nekat prabowo,kJa9psDBsyY,"MALAYSIA MAKIN NEKAT! PRABOWO TURUN TANGAN, SEBATIK MEMANAS JIRAN CIUT NYALI!",2026-02-09,692.0,9506.0,0:04:05,35.53,,,,,,,,0.0,0.0,2.0,2.0,134.0,5.0,96.4,6.0,57.0,0.0,1.0,0.0,609.095,41877.475,0.0,41877.475,76190.308,9197.0,9739.27,8284.257,7823.0,4536.323,0.0,4.0,109.0,47091.069,1.0,640.324,635.717,0.0,57.0,4.9977,0.9413,5.0,5.0,0.2256,2.0,1.0,1.0,0.0,,,0.0,0.0,0.0,,0.0,0.0,0.0,,94.0,3.68,2556.0,9506.0,649.2752,0.0,43122.287,35338.0,22.06,malaysia makin nekat prabowo
DUEL MAUT ASEAN! M-346 RI VS FA-50... (Shorts),2026-02-09,18.15,duel maut asean m,2026-02-09|duel maut asean m,D32wcKU5avk,DUEL MAUT ASEAN!M-346 RI VS FA-50 MALAYSIASIAPA PALING KUAT &PALING CUPU?,2026-02-09,75.0,5975.0,0:01:01,82.49,83.71,,,,,,,0.0,0.0,2.0,0.0,186.0,9.0,95.38,1.0,7.0,0.0,0.0,,21.595,0.0,0.0,0.0,,,,,,280.233,0.0,3.0,4369.0,0.0,0.0,0.0,0.0,0.0,50.0,0.4071,,,,,0.0,,,0.0,,,0.0,0.0,0.0,,0.0,0.0,0.0,,0.0,,0.0,9894.0,103.2065,2.0,1674.097,12349.0,8.53,duel maut asean m
MEMANAS! MALAYSIA NYATAKAN PERANG...,2026-02-09,20.15,memanas malaysia nyatakan perang,2026-02-09|memanas malaysia nyatakan perang,D32wcKU5avk,"MEMANAS! MALAYSIA NYATAKAN PERANG, PRABOWO KERAHKAN RIBUAN PASUKAN DI PERBATASAN",2026-02-09,503.0,23918.0,0:03:54,46.53,,,,,,,,0.0,0.0,6.0,5.0,391.0,7.0,98.24,17.0,252.0,0.0,0.0,,1104.667,107394.543,0.0,107394.543,195378.38,23925.0,9241.244,8166.285,21142.0,4536.508,0.0,18.0,339.0,0.0,0.0,0.0,0.0,0.0,126.0,8.6172,0.5788,7.0,1.75,0.1731,10.0,0.0,0.0,0.0,,,0.0,0.0,0.0,,0.0,0.0,0.0,,310.0,1.83,16918.0,23918.0,1554.978,1.0,108499.21,81981.0,26.0,memanas malaysia nyatakan perang
ANWAR IBRAHIM SERUKAN PERANG LAWAN INDONESIA...,2026-02-10,7.15,anwar ibrahim serukan perang,2026-02-10|anwar ibrahim serukan perang,CRfy3stjUOA,ANWAR IBRAHIM SERUKAN PERANG LAWAN INDONESIA PRABOWO: INDONESIA TAK AKAN GENTAR SEDIKITPUN!,2026-02-10,531.0,6085.0,0:03:35,40.67,,,,,,,,0.0,0.0,0.0,0.0,111.0,3.0,97.37,8.0,77.0,0.0,0.0,,172.807,32059.976,0.0,32059.976,58327.762,6513.0,10410.095,8955.591,5603.0,5297.058,0.0,0.0,0.0,0.0,0.0,0.0,0.0,0.0,23.0,1.4027,,,,0.1807,8.0,1.0,0.0,0.0,,,0.0,0.0,0.0,,0.0,0.0,0.0,,45.0,2.26,1988.0,6085.0,365.0206,0.0,32232.783,20662.0,23.88,anwar ibrahim serukan perang
PRABOWO GERTAK JIRAN! MALAYSIA AUTO KEOK...,2026-02-10,10.15,prabowo gertak jiran malaysia,2026-02-10|prabowo gertak jiran malaysia,CRfy3stjUOA,"PRABOWO GERTAK JIRAN! MALAYSIA AUTO KEOK, ASKAR MALAYSIA GEMETAR LIHAT GAGAHNYA TNI",2026-02-10,600.0,5736.0,0:03:53,38.92,,,,,,,,0.0,0.0,3.0,2.0,122.0,3.0,97.6,7.0,76.0,0.0,0.0,,283.659,35895.606,0.0,35895.606,65302.784,6917.0,11117.26,9440.911,5874.0,6307.409,0.0,0.0,34.0,0.0,0.0,0.0,0.0,0.0,28.0,2.5354,,,,0.1999,42.0,0.0,0.0,0.0,,,0.0,0.0,0.0,,0.0,0.0,0.0,,0.0,,0.0,5736.0,372.1224,1.0,36179.266,21576.0,20.49,prabowo gertak jiran malaysia
PRABOWO TANTANG ANWAR IBRAHIM! TNI BERSIAP...,2026-02-10,13.15,prabowo tantang anwar ibrahim,2026-02-10|prabowo tantang anwar ibrahim,f3r4R_LO-10,"PRABOWO TANTANG ANWAR IBRAHIM! TNI BERSIAP PERANG BESAR, TNI LANGSUNG KEPUNG BLOK AMBALAT‼",2026-02-10,600.0,22791.0,0:04:05,40.92,,,,,,,,0.0,0.0,18.0,11.0,398.0,9.0,97.79,22.0,342.0,0.0,1.0,0.0,989.687,110464.334,0.0,110464.334,200953.824,23816.0,10065.305,8437.766,19965.0,5020.01,0.0,12.0,220.0,54694.946,1.0,2971.048,2953.523,0.0,100.0,7.1073,545.0,4.0,4.0,0.2,13.0,0.0,0.0,0.0,1.0,1680.0,0.0,0.0,0.0,,0.0,0.0,0.0,,289.0,2.22,13037.0,22791.0,1554.4904,7.0,114407.545,78854.0,25.02,prabowo tantang anwar ibrahim
GEGER‼ NETIZEN MALAYSIA HINA INDONESIA...,2026-02-11,10.15,geger netizen malaysia hina,2026-02-11|geger netizen malaysia hina,iwZ_GJoKqiY,"GEGER‼ NETIZEN MALAYSIA HINA INDONESIA, SABAH-SARAWAK IKUT DIHINA: ""JANGAN CARI KERJA DISINI!""",2026-02-11,600.0,4560.0,0:03:46,37.68,,,,,,,,0.0,0.0,1.0,2.0,88.0,2.0,97.78,3.0,66.0,0.0,0.0,,335.107,23047.641,0.0,23047.641,41936.112,4980.0,9757.122,8420.906,4298.0,5128.932,0.0,0.0,0.0,0.0,0.0,0.0,0.0,0.0,33.0,2.4955,,,,0.1999,7.0,0.0,0.0,0.0,,,0.0,0.0,0.0,,0.0,0.0,0.0,,32.0,2.51,1274.0,4560.0,286.4011,-1.0,23382.749,18987.0,18.69,geger netizen malaysia hina
MALAYSIA KOCAR-KACIR! PRABOWO SIAGAKAN TNI...,2026-02-11,13.15,malaysia kocar kacir prabowo,2026-02-11|malaysia kocar kacir prabowo,cKUcDb73SUs,"MALAYSIA KOCAR-KACIR! PRABOWO SIAGAKAN TNI, AUSTRALIA BELA MATI-MATIAN INDONESIA",2026-02-11,579.0,18235.0,0:03:52,40.13,,,,,,,,0.0,0.0,8.0,7.0,319.0,5.0,98.46,9.0,96.0,0.0,0.0,,845.783,100896.318,0.0,100896.318,183551.707,20997.0,10273.8,8741.806,17866.0,5579.968,0.0,13.0,215.0,0.0,0.0,0.0,0.0,0.0,92.0,6.256,0.2702,2.0,,0.1941,7.0,0.0,0.0,0.0,,,0.0,0.0,0.0,,0.0,0.0,0.0,,220.0,1.99,11049.0,18235.0,1176.8988,1.0,101742.102,61065.0,26.65,malaysia kocar kacir prabowo
