ACEH MENGHINA SUKU JAWA! SULTAN ACEH...,2025-12-30,11.15,aceh menghina suku jawa,2025-12-30|aceh menghina suku jawa,3L4mXcAIyYs,ACEH MENGHINA SUKU JAWA! SULTAN ACEH NGAMUK: JANGAN JUAL NAMA ACEH!,2025-12-30,600.0,143510.0,0:04:41,46.99,,,,,,,,0.0,0.0,343.0,20.0,1286.0,29.0,97.79,110.0,606.0,0.0,0.0,,3169.875,324307.26,0.0,324307.26,590167.867,104281.0,6475.47,5659.4,91139.0,2284.292,0.0,88.0,2495.0,0.0,0.0,0.0,0.0,0.0,454.0,35.6404,0.2981,2.0,,,0.0,,,0.0,,,0.0,0.0,0.0,,0.0,0.0,0.0,,508.0,0.89,57306.0,143510.0,11238.2848,323.0,327477.134,1116216.0,11.47,aceh menghina suku jawa
TAKTIK GERTAK SAMBAL MALAYSIA GAGAL!...,2025-12-30,13.15,taktik gertak sambal malaysia,2025-12-30|taktik gertak sambal malaysia,w6rgxiEEsxc,TAKTIK GERTAK SAMBAL MALAYSIA GAGAL! TNI SUDAH SIAPKAN SKENARIO PERANG DI AMBALAT!,2025-12-30,600.0,10777.0,0:04:10,41.69,,,,,,,,0.0,0.0,4.0,2.0,205.0,5.0,97.62,12.0,158.0,0.0,0.0,,673.575,49180.521,0.0,49180.521,89419.138,10453.0,10118.721,8554.4,8837.0,4625.969,0.0,0.0,0.0,0.0,0.0,0.0,0.0,0.0,60.0,5.2122,,,,0.1999,3.0,0.0,0.0,0.0,,,0.0,0.0,0.0,,0.0,0.0,0.0,,58.0,1.65,3508.0,10777.0,748.8427,2.0,49854.096,44105.0,20.53,taktik gertak sambal malaysia
MALAYSIA KENA MENTAL! WARGA PERBATASAN...,2025-12-31,16.15,malaysia kena mental warga,2025-12-31|malaysia kena mental warga,djWPlmjsnUg,MALAYSIA KENA MENTAL! WARGA PERBATASAN SABAH DAN SARAWAK RAMAI-RAMAI INGIN GABUNG INDONESIA!,2025-12-31,600.0,13242.0,0:04:29,44.86,,,,,,,,0.0,0.0,10.0,9.0,215.0,4.0,98.17,9.0,128.0,0.0,0.0,,576.206,43974.77,0.0,43974.77,80010.154,10415.0,9098.266,7682.204,8794.0,3368.439,0.0,0.0,0.0,0.0,0.0,0.0,0.0,0.0,75.0,5.7026,0.5155,4.0,2.0,,0.0,,,0.0,,,0.0,0.0,0.0,,0.0,0.0,0.0,,108.0,1.46,7382.0,13242.0,990.0548,1.0,44550.977,78522.0,13.56,malaysia kena mental warga
GILA TAK ADA TOKO MALAYSIA... (Shorts),2025-12-31,17.0,gila tak ada toko,2025-12-31|gila tak ada toko,J3SZJhrioxI,GILA TAK ADA TOKO MALAYSIA WARGA MALAYSIA INI TERKEJUT LIHAT TOKO NUSANTARA KUASAI KOTA PHILADELPHIA,2025-12-31,98.0,4952.0,0:01:14,76.01,79.47,,,,,,,0.0,0.0,5.0,0.0,203.0,5.0,97.6,3.0,15.0,0.0,0.0,,21.093,0.0,0.0,0.0,,,,,,260.558,0.0,3.0,3860.0,0.0,0.0,0.0,0.0,0.0,38.0,0.4075,,,,,0.0,,,0.0,,,0.0,0.0,0.0,,0.0,0.0,0.0,,0.0,,0.0,8433.0,102.9875,5.0,1290.466,8597.0,8.63,gila tak ada toko
JANGAN MAIN API! KAPAL PERANG TNI AL...,2025-12-31,18.3,jangan main api kapal,2025-12-31|jangan main api kapal,XwQY8m8wdqU,JANGAN MAIN API! KAPAL PERANG TNI AL HAJAR KAPAL MALAYSIA YANG BANDEL DI SELAT MALAKA!,2025-12-31,574.0,29653.0,0:03:53,40.66,,,,,,,,0.0,0.0,21.0,6.0,483.0,8.0,98.37,14.0,271.0,0.0,0.0,,1166.182,91357.595,0.0,91357.595,166104.629,22956.0,8088.461,7235.783,20536.0,3120.215,0.0,0.0,0.0,0.0,0.0,0.0,0.0,0.0,153.0,10.2839,,,,0.1928,5.0,1.0,0.0,0.0,,,0.0,0.0,0.0,,0.0,0.0,0.0,,151.0,1.99,7569.0,29653.0,1922.2278,15.0,92523.777,163260.0,16.73,jangan main api kapal
WASPADA! MEDIA MALAYSIA BONGKAR KECANGGIHAN KRI...,2026-01-01,10.3,waspada media malaysia bongkar,2026-01-01|waspada media malaysia bongkar,J3SZJhrioxI,WASPADA! MEDIA MALAYSIA BONGKAR KECANGGIHAN KRI PRABU SILIWANGI YANG BIKIN ASEAN PANIK!,2026-01-01,540.0,19282.0,0:03:39,40.72,,,,,,,,0.0,0.0,9.0,7.0,326.0,4.0,98.79,3.0,46.0,0.0,0.0,,644.942,52434.145,0.0,52434.145,95403.051,13458.0,8003.612,7088.947,11920.0,2752.818,0.0,0.0,0.0,0.0,0.0,0.0,0.0,0.0,99.0,5.923,0.3712,4.0,4.0,,0.0,,,0.0,,,0.0,0.0,0.0,,0.0,0.0,0.0,,90.0,1.8,5007.0,19282.0,1177.8171,2.0,53079.088,101312.0,16.21,waspada media malaysia bongkar
MANTAN SNIPER MALAYSIA AKUI: TAK TAKUT PERANG...,2026-01-01,14.15,mantan sniper malaysia akui,2026-01-01|mantan sniper malaysia akui,ZEz4ZHmB6gA,"MANTAN SNIPER MALAYSIA AKUI: TAK TAKUT PERANG, INGGRIS DAN AUSTRALIA SIAP TURUN TANGAN!",2026-01-01,540.0,16949.0,0:04:18,47.92,,,,,,,,0.0,0.0,6.0,0.0,168.0,3.0,98.25,11.0,318.0,0.0,0.0,,527.404,39269.614,0.0,39269.614,71446.465,10810.0,7174.06,6609.294,9959.0,2348.064,0.0,0.0,0.0,0.0,0.0,0.0,0.0,0.0,67.0,4.9249,0.2658,2.0,2.0,,0.0,,,0.0,,,0.0,0.0,0.0,,0.0,0.0,0.0,,183.0,1.51,12156.0,16949.0,1218.3404,6.0,39797.018,92056.0,16.1,mantan sniper malaysia akui
TIMOR LESTE MENANGIS LIHAT PAPUA! DULU PILIH...,2026-01-01,16.15,timor leste menangis lihat,2026-01-01|timor leste menangis lihat,J3SZJhrioxI,"TIMOR LESTE MENANGIS LIHAT PAPUA! DULU PILIH MERDEKA, SEKARANG IRI LIHAT KEMAJUAN MEGAH NKRI!",2026-01-01,588.0,101805.0,0:04:35,46.86,,,,,,,,0.0,0.0,166.0,28.0,1467.0,24.0,98.39,53.0,337.0,0.0,2.0,0.0,5360.085,249552.808,0.0,249552.808,454045.175,71748.0,7156.516,6328.332,63445.0,2514.513,0.0,186.0,4477.0,20129.395,2.0,1096.788,1086.984,0.0,602.0,46.1934,0.2095,3.0,1.5,0.1964,10.0,1.0,0.0,0.0,,,0.0,0.0,0.0,,0.0,0.0,0.0,,795.0,1.36,58448.0,101805.0,7791.3586,138.0,255999.877,817651.0,10.95,timor leste menangis lihat
DPR MALAYSIA TAKUT ANCAMAN PERANG INDONESIA...,2026-01-02,7.15,dpr malaysia takut ancaman,2026-01-02|dpr malaysia takut ancaman,ZEz4ZHmB6gA,"DPR MALAYSIA TAKUT ANCAMAN PERANG INDONESIA, AKUI TNI SEBAGAI MILITER TERKUAT DI ASEAN",2026-01-02,619.0,87699.0,0:04:28,43.33,,,,,,,,0.0,0.0,55.0,16.0,841.0,18.0,97.9,32.0,844.0,0.0,1.0,0.0,2867.787,243778.554,0.0,243778.554,443377.883,65547.0,7702.48,6764.274,57563.0,2844.208,0.0,73.0,1442.0,50673.363,1.0,2758.23,2736.348,0.0,373.0,29.1507,0.3516,4.0,2.0,0.2053,19.0,0.0,0.0,0.0,,,0.0,0.0,0.0,,0.0,0.0,0.0,,675.0,2.34,28893.0,87699.0,6533.8655,39.0,249382.688,532270.0,14.71,dpr malaysia takut ancaman
NGAKAK! AKSI-AKSI TENTARA MALAYSIA BUAT KETAWA...,2026-01-02,13.15,ngakak aksi aksi tentara,2026-01-02|ngakak aksi aksi tentara,UGMt503wD8c,"NGAKAK! AKSI-AKSI TENTARA MALAYSIA BUAT KETAWA SAKIT PERUT, JAUH BEDA SAMA GAHARNYA TNI!",2026-01-02,540.0,51539.0,0:04:00,44.48,,,,,,,,0.0,0.0,35.0,6.0,515.0,24.0,95.55,13.0,254.0,0.0,0.0,,2551.027,123658.739,0.0,123658.739,224982.529,28471.0,8785.635,7902.165,25608.0,2449.638,0.0,16.0,409.0,0.0,0.0,0.0,0.0,0.0,303.0,20.8009,0.3509,4.0,2.0,0.1834,20.0,0.0,0.0,0.0,,,0.0,0.0,0.0,,0.0,0.0,0.0,,302.0,1.51,20034.0,51539.0,3438.698,29.0,126209.766,350473.0,12.77,ngakak aksi aksi tentara
MAU AJAK PERANG? ATUK MALAYSIA HALU...,2026-01-02,16.15,mau ajak perang atuk,2026-01-02|mau ajak perang atuk,UGMt503wD8c,MAU AJAK PERANG? ATUK MALAYSIA HALU MAU KERAHKAN NUKLIR KE SELAT MALAKA LAWAN INDONESIA!,2026-01-02,510.0,6968.0,0:03:48,44.89,,,,,,,,0.0,0.0,1.0,1.0,103.0,6.0,94.5,3.0,123.0,0.0,0.0,,140.912,24417.686,0.0,24417.686,44422.757,5275.0,9553.281,8421.376,4650.0,3523.963,0.0,8.0,101.0,0.0,0.0,0.0,0.0,0.0,20.0,1.2746,,,,0.1749,10.0,0.0,0.0,0.0,,,0.0,0.0,0.0,,0.0,0.0,0.0,,69.0,2.5,2755.0,6968.0,443.1084,0.0,24558.598,30485.0,18.44,mau ajak perang atuk
PANTAS NGOTOT INGIN MERDEKA? LIHAT PERBANDINGAN...,2026-01-03,7.3,pantas ngotot ingin merdeka,2026-01-03|pantas ngotot ingin merdeka,ZEz4ZHmB6gA,PANTAS NGOTOT INGIN MERDEKA? LIHAT PERBANDINGAN GILA MILITER INDONESIA VS TIMOR LESTE SEKARANG!,2026-01-03,510.0,4308.0,0:03:20,39.31,,,,,,,,0.0,0.0,1.0,0.0,52.0,2.0,96.3,1.0,18.0,0.0,0.0,,181.83,14124.772,0.0,14124.772,25700.973,3454.0,8248.066,7440.93,3116.0,3320.93,0.0,2.0,69.0,0.0,0.0,0.0,0.0,0.0,18.0,1.3616,0.3241,4.0,2.0,0.1749,23.0,0.0,0.0,0.0,,,0.0,0.0,0.0,,0.0,0.0,0.0,,35.0,1.53,2287.0,4308.0,239.9078,1.0,14306.601,26963.0,11.55,pantas ngotot ingin merdeka
TERBONGKAR! PERJANJIAN TERBURUK MALAYSIA...,2026-01-03,10.15,terbongkar perjanjian terburuk malaysia,2026-01-03|terbongkar perjanjian terburuk malaysia,ny7YQJiSmVk,"TERBONGKAR! PERJANJIAN TERBURUK MALAYSIA DENGAN AMERIKA TERUNGKAP, NEGARA JIRAN MERASA DIJAJAH!",2026-01-03,633.0,3600.0,0:04:17,40.65,,,,,,,,0.0,0.0,0.0,0.0,51.0,3.0,94.44,6.0,28.0,0.0,0.0,,175.541,14996.363,0.0,14996.363,27284.154,3064.0,10241.8,8904.75,2664.0,4215.556,0.0,0.0,76.0,0.0,0.0,0.0,0.0,0.0,14.0,1.5082,,,,0.2091,14.0,0.0,0.0,0.0,,,0.0,0.0,0.0,,0.0,0.0,0.0,,45.0,3.16,1424.0,3600.0,257.3399,0.0,15171.904,20666.0,13.07,terbongkar perjanjian terburuk malaysia
CHINA OBOK-OBOK LAUT MALAYSIA DI TAHUN BARU...,2026-01-03,16.3,china obok obok laut,2026-01-03|china obok obok laut,nghipceI2l0,"CHINA OBOK-OBOK LAUT MALAYSIA DI TAHUN BARU, RI BANGUN KAPAL PERANG MONSTER, CCG AUTO PUTAR BALIK",2026-01-03,540.0,7457.0,0:04:02,44.9,,,,,,,,0.0,0.0,2.0,1.0,151.0,3.0,98.05,0.0,66.0,0.0,0.0,,354.659,20968.971,0.0,20968.971,38151.105,5230.0,8304.551,7294.666,4594.0,2859.543,0.0,0.0,0.0,0.0,0.0,0.0,0.0,0.0,34.0,2.7888,0.2266,3.0,,0.1833,3.0,0.0,0.0,0.0,,,0.0,0.0,0.0,,0.0,0.0,0.0,,92.0,3.1,2965.0,7457.0,502.2045,1.0,21323.63,40824.0,15.42,china obok obok laut
DPR MALAYSIA PANIK! AKUI KAPAL SELAM RI...,2026-01-03,19.15,dpr malaysia panik akui,2026-01-03|dpr malaysia panik akui,UGMt503wD8c,"DPR MALAYSIA PANIK! AKUI KAPAL SELAM RI BISA MASUK TANPA TERDETEKSI, PERTAHANAN JIRAN USANG!",2026-01-03,552.0,10213.0,0:04:12,45.78,,,,,,,,0.0,0.0,7.0,2.0,215.0,3.0,98.62,3.0,78.0,0.0,0.0,,564.228,28269.451,0.0,28269.451,51433.706,6489.0,9092.046,7926.292,5657.0,2823.233,0.0,0.0,0.0,0.0,0.0,0.0,0.0,0.0,64.0,4.7024,,,,0.1865,14.0,1.0,0.0,0.0,,,0.0,0.0,0.0,,0.0,0.0,0.0,,115.0,2.81,4094.0,10213.0,716.963,5.0,28833.678,63981.0,13.66,dpr malaysia panik akui
MONSTER LAUT BARU! KRI BALAPUTRA DEWA...,2026-01-03,20.15,monster laut baru kri,2026-01-03|monster laut baru kri,Rzn2DPJ9jUU,"MONSTER LAUT BARU! KRI BALAPUTRA DEWA PUNYA 64 RUDAL MEMATIKAN, KAPAL PERUSAK JIRAN PUN GEMETAR!",2026-01-03,675.0,3247.0,0:04:15,37.8,,,,,,,,0.0,0.0,3.0,1.0,96.0,0.0,100.0,0.0,18.0,0.0,0.0,,181.761,11149.481,0.0,11149.481,20286.655,2572.0,9457.648,7887.502,2145.0,3489.763,0.0,2.0,55.0,0.0,0.0,0.0,0.0,0.0,16.0,1.3408,0.5617,3.0,3.0,0.2206,27.0,0.0,0.0,0.0,,,0.0,0.0,0.0,,0.0,0.0,0.0,,42.0,3.18,1319.0,3247.0,230.1122,2.0,11331.242,23145.0,10.48,monster laut baru kri
"TNI KEPUNG AMBALAT, DPR MALAYSIA MASIH NEKAT...",2026-01-04,7.15,tni kepung ambalat dpr,2026-01-04|tni kepung ambalat dpr,7bW2gQr34v0,"TNI KEPUNG AMBALAT, DPR MALAYSIA MASIH NEKAT KLAIM HAK MILIK SEPENUHNYA!",2026-01-04,616.0,9430.0,0:04:15,41.41,,,,,,,,0.0,0.0,3.0,1.0,193.0,3.0,98.47,6.0,174.0,0.0,0.0,,376.739,42406.828,0.0,42406.828,77150.723,8911.0,9996.207,8657.92,7718.0,4537.993,0.0,1.0,82.0,0.0,0.0,0.0,0.0,0.0,51.0,3.4755,342.0,2.0,,0.2044,15.0,0.0,0.0,0.0,,,0.0,0.0,0.0,,0.0,0.0,0.0,,96.0,2.62,3661.0,9430.0,668.186,2.0,42783.567,33196.0,23.44,tni kepung ambalat dpr
RAKYAT ACEH ASLI BUNGKAM & PERMALUKAN MALAYSIA...,2026-01-04,10.15,rakyat aceh asli bungkam,2026-01-04|rakyat aceh asli bungkam,ugActPlwkDU,RAKYAT ACEH ASLI BUNGKAM & PERMALUKAN MALAYSIA: KAMI CINTA & SETIA NKRI!,2026-01-04,510.0,4229.0,0:03:46,44.32,,,,,,,,0.0,0.0,2.0,2.0,84.0,3.0,96.55,8.0,34.0,0.0,0.0,,149.15,15172.089,0.0,15172.089,27607.858,3695.0,8260.879,7471.68,3342.0,3623.366,0.0,0.0,0.0,0.0,0.0,0.0,0.0,0.0,30.0,1.5635,0.2819,4.0,1.3333,0.1748,24.0,0.0,0.0,0.0,,,0.0,0.0,0.0,,0.0,0.0,0.0,,50.0,1.63,3063.0,4229.0,265.5454,0.0,15321.239,16004.0,20.81,rakyat aceh asli bungkam
AKIBAT REMEHIN PETANI! PASOKAN KELAPA MALAYSIA...,2026-01-04,13.15,akibat remehin petani pasokan,2026-01-04|akibat remehin petani pasokan,FdxbhVVYPqA,"AKIBAT REMEHIN PETANI! PASOKAN KELAPA MALAYSIA KRITIS, TERPAKSA GANTUNG NASIB KE INDONESIA!",2026-01-04,510.0,4641.0,0:03:08,37.02,,,,,,,,0.0,0.0,0.0,0.0,88.0,0.0,100.0,4.0,49.0,0.0,0.0,,325.096,15329.856,0.0,15329.856,27893.371,3656.0,8579.936,7629.478,3251.0,3373.203,0.0,2.0,33.0,0.0,0.0,0.0,0.0,0.0,34.0,2.3172,0.4978,6.0,3.0,0.1748,13.0,0.0,0.0,0.0,,,0.0,0.0,0.0,,0.0,0.0,0.0,,29.0,1.92,1512.0,4641.0,243.4219,0.0,15654.952,21114.0,18.5,akibat remehin petani pasokan
MALAYSIA SYOK BERAT! INDONESIA NEKAT BANTU IRAN...,2026-01-04,19.15,malaysia syok berat indonesia,2026-01-04|malaysia syok berat indonesia,7N9jKY9WIKw,"MALAYSIA SYOK BERAT! INDONESIA NEKAT BANTU IRAN YANG TERPURUK, PRABOWO JADI PAHLAWAN",2026-01-04,503.0,12944.0,0:03:59,47.58,,,,,,,,0.0,0.0,4.0,4.0,268.0,3.0,98.89,1.0,48.0,0.0,0.0,,473.334,44418.98,0.0,44418.98,80812.405,9948.0,9248.387,8123.483,8738.0,3468.731,0.0,0.0,0.0,0.0,0.0,0.0,0.0,0.0,56.0,4.4866,0.1355,1.0,1.0,0.1729,12.0,0.0,0.0,0.0,,,0.0,0.0,0.0,,0.0,0.0,0.0,,176.0,3.07,5735.0,12944.0,860.4676,0.0,44892.313,56366.0,19.36,malaysia syok berat indonesia
PRABOWO NGAMUK! INDONESIA SKAKMAT 9 NEGARA...,2026-01-05,7.15,prabowo ngamuk indonesia skakmat,2026-01-05|prabowo ngamuk indonesia skakmat,wvQj_jIpI0k,"PRABOWO NGAMUK! INDONESIA SKAKMAT 9 NEGARA PEMASOK SENJATA OPM, JANGAN BERANI USIK PAPUA!",2026-01-05,615.0,10248.0,0:04:38,45.3,,,,,,,,0.0,0.0,6.0,6.0,230.0,10.0,95.83,15.0,89.0,0.0,0.0,,538.456,53766.757,0.0,53766.757,97810.785,10069.0,11446.552,9714.052,8545.0,5299.094,0.0,0.0,0.0,0.0,0.0,0.0,0.0,0.0,52.0,3.89,0.1866,2.0,2.0,0.2041,11.0,0.0,0.0,0.0,,,0.0,0.0,0.0,,0.0,0.0,0.0,,149.0,3.22,4631.0,10248.0,793.0238,0.0,54305.213,34594.0,24.37,prabowo ngamuk indonesia skakmat
KENA KARMA! DULU REMEHKAN & HINA TKI...,2026-01-05,10.15,kena karma dulu remehkan,2026-01-05|kena karma dulu remehkan,7N9jKY9WIKw,"KENA KARMA! DULU REMEHKAN & HINA TKI,  KINI MALAYSIA MENANGIS MINTA TKI DIKEMBALIKAN LAGI",2026-01-05,600.0,4697.0,0:04:15,42.59,,,,,,,,0.0,0.0,3.0,3.0,86.0,4.0,95.56,10.0,59.0,0.0,0.0,,288.541,16245.957,0.0,16245.957,29559.161,3665.0,9188.424,8065.255,3217.0,3520.986,0.0,0.0,0.0,0.0,0.0,0.0,0.0,0.0,24.0,2.1613,,,,0.1998,11.0,0.0,0.0,0.0,,,0.0,0.0,0.0,,0.0,0.0,0.0,,52.0,2.91,1787.0,4697.0,333.38,0.0,16534.498,25886.0,14.75,kena karma dulu remehkan
WARGA MALAYSIA NGAMUK! KELAKUAN WARGA BANGLADESH...,2026-01-05,13.15,warga malaysia ngamuk kelakuan,2026-01-05|warga malaysia ngamuk kelakuan,hIKYEL2HP2Y,WARGA MALAYSIA NGAMUK! KELAKUAN WARGA BANGLADESH BIKIN KACAU MALAYSIA,2026-01-05,600.0,30513.0,0:03:33,35.61,,,,,,,,0.0,0.0,12.0,2.0,325.0,14.0,95.87,17.0,300.0,0.0,0.0,,1675.888,82690.672,0.0,82690.672,150457.826,20211.0,8712.596,7444.353,17269.0,2764.998,0.0,0.0,0.0,0.0,0.0,0.0,0.0,0.0,182.0,13.3617,0.5776,4.0,,0.1997,7.0,0.0,0.0,0.0,,,0.0,0.0,0.0,,0.0,0.0,0.0,,114.0,1.11,10263.0,30513.0,1810.7988,10.0,84366.561,127456.0,20.49,warga malaysia ngamuk kelakuan
BEDA KELAS! TENTARA WANITA MALAYSIA DIHUJAT...,2026-01-05,16.3,beda kelas tentara wanita,2026-01-05|beda kelas tentara wanita,wvQj_jIpI0k,BEDA KELAS! TENTARA WANITA MALAYSIA DIHUJAT NETIZEN GARA-GARA LATIHAN MIRIP SENAM PAGI!,2026-01-05,570.0,60121.0,0:04:26,46.73,,,,,,,,0.0,0.0,48.0,9.0,698.0,18.0,97.49,16.0,270.0,0.0,0.0,,4661.044,144608.712,0.0,144608.712,263137.54,39309.0,7578.846,6694.079,34720.0,2483.303,0.0,37.0,922.0,0.0,0.0,0.0,0.0,0.0,516.0,37.9183,0.6983,8.0,8.0,0.1916,3.0,0.0,0.0,0.0,,,0.0,0.0,0.0,,0.0,0.0,0.0,,548.0,1.57,34959.0,60121.0,4448.1221,39.0,149269.757,515988.0,10.26,beda kelas tentara wanita
MALAYSIA TERKEJUT! RUSIA SERIUS DUKUNG PRABOWO...,2026-01-05,18.15,malaysia terkejut rusia serius,2026-01-05|malaysia terkejut rusia serius,w0mv4Eboqt8,"MALAYSIA TERKEJUT! RUSIA SERIUS DUKUNG PRABOWO, SIAP TRANSFER SEMUA ILMU NUKLIR KE INDONESIA!!",2026-01-05,557.0,13323.0,0:03:59,43.06,,,,,,,,0.0,0.0,9.0,7.0,422.0,2.0,99.53,33.0,122.0,0.0,0.0,,601.074,60702.481,0.0,60702.481,110419.066,11149.0,11412.823,9903.943,9675.0,4601.35,0.0,0.0,0.0,0.0,0.0,0.0,0.0,0.0,60.0,4.5537,0.1579,4.0,4.0,0.1879,17.0,0.0,0.0,0.0,,,0.0,0.0,0.0,,0.0,0.0,0.0,,149.0,1.87,7964.0,13323.0,887.5861,2.0,61303.556,54834.0,19.79,malaysia terkejut rusia serius
BENDERA MALAYSIA DIBAKAR DI ACEH...,2026-01-06,8.15,bendera malaysia dibakar di,2026-01-06|bendera malaysia dibakar di,SvIcv_W-bXE,"BENDERA MALAYSIA DIBAKAR DI ACEH, TAK TERIMA JIRAN HASUT RAKYAT PECAH BELAH NKRI!",2026-01-06,526.0,17866.0,0:03:43,42.5,,,,,,,,0.0,0.0,5.0,10.0,514.0,7.0,98.66,33.0,346.0,0.0,0.0,,942.098,76171.341,0.0,76171.341,138560.442,14993.0,10655.217,9241.676,13004.0,4316.214,0.0,8.0,224.0,0.0,0.0,0.0,0.0,0.0,105.0,7.1849,0.6291,6.0,3.0,0.1794,7.0,0.0,0.0,0.0,,,0.0,0.0,0.0,,0.0,0.0,0.0,,192.0,3.18,6035.0,17866.0,1109.4956,-5.0,77113.439,60896.0,25.37,bendera malaysia dibakar di
MEDIA ASING BONGKAR DATA MILITER RI VS MALAYSIA...,2026-01-06,13.15,media asing bongkar data,2026-01-06|media asing bongkar data,ptMxRn5M4nw,"MEDIA ASING BONGKAR DATA MILITER RI VS MALAYSIA, SEBUT INDONESIA ADIDAYA SETARA AS DAN CHINA!",2026-01-06,480.0,2916.0,0:03:58,49.66,,,,,,,,0.0,0.0,2.0,1.0,77.0,4.0,95.06,0.0,17.0,0.0,0.0,,138.168,11009.115,0.0,11009.115,20030.549,2183.0,10351.705,9175.698,1935.0,3823.577,0.0,3.0,71.0,0.0,0.0,0.0,0.0,0.0,22.0,1.5226,,,,0.1666,16.0,3.0,0.0,0.0,,,0.0,0.0,0.0,,0.0,0.0,0.0,,51.0,2.47,2068.0,2916.0,193.0688,1.0,11147.283,20117.0,10.87,media asing bongkar data
TNI KEPUNG TOTAL BLOK AMBALAT DENGAN KAPAL...,2026-01-06,16.15,tni kepung total blok,2026-01-06|tni kepung total blok,tIXwkNqzsgg,"TNI KEPUNG TOTAL BLOK AMBALAT DENGAN KAPAL PERANG, JIRAN JANGAN COBA-COBA USIK KEDAULATAN RI!",2026-01-06,600.0,5498.0,0:04:04,40.74,,,,,,,,0.0,0.0,2.0,1.0,161.0,4.0,97.58,2.0,103.0,0.0,0.0,,168.604,28073.009,0.0,28073.009,51071.197,5403.0,11165.544,9452.378,4574.0,5136.691,0.0,0.0,0.0,0.0,0.0,0.0,0.0,0.0,29.0,1.4335,,,,0.1999,7.0,0.0,0.0,0.0,,,0.0,0.0,0.0,,0.0,0.0,0.0,,53.0,1.7,3113.0,5498.0,373.2767,1.0,28241.613,17649.0,22.45,tni kepung total blok
GEMPAR! 6 NEGARA MAJU REBUTAN IMPOR BUS...,2026-01-06,19.0,gempar 6 negara maju,2026-01-06|gempar 6 negara maju,Sj2NLqwW2B8,"GEMPAR! 6 NEGARA MAJU REBUTAN IMPOR BUS DARI INDONESIA, MALAYSIA MAKIN IRI",2026-01-06,591.0,51336.0,0:04:22,44.42,,,,,,,,8.0,640.0,72.0,19.0,861.0,16.0,98.18,74.0,102.0,0.0,0.0,,4005.604,178733.817,0.0,178733.817,325193.456,41058.0,9389.97,7920.343,34632.0,3561.225,0.0,0.0,0.0,0.0,0.0,0.0,0.0,0.0,421.0,31.9468,0.5111,6.0,6.0,0.1171,4.0,0.0,0.0,0.0,,,0.0,0.0,0.0,,0.0,0.0,0.0,,624.0,3.34,18669.0,51336.0,3743.3381,53.0,182739.42,376042.0,11.98,gempar 6 negara maju
"JOHOR INGIN MANDIRI, SABAH & SARAWAK MUAK...",2026-01-06,20.3,johor ingin mandiri sabah,2026-01-06|johor ingin mandiri sabah,SvIcv_W-bXE,"JOHOR INGIN MANDIRI, SABAH & SARAWAK MUAK JADI ANAK TIRI MALAYSIA!",2026-01-06,617.0,3575.0,0:04:07,40.07,,,,,,,,0.0,0.0,3.0,1.0,93.0,4.0,95.88,7.0,58.0,0.0,0.0,,183.285,12236.849,0.0,12236.849,22264.85,2833.0,9181.381,7859.107,2425.0,3474.145,0.0,3.0,56.0,0.0,0.0,0.0,0.0,0.0,17.0,1.3218,,,,0.1656,32.0,0.0,0.0,0.0,,,0.0,0.0,0.0,,0.0,0.0,0.0,,43.0,2.35,1832.0,3575.0,245.5008,2.0,12420.134,18624.0,14.88,johor ingin mandiri sabah
DIHINA HAMA‼️ JATI DIRI SUKU JAWA DI SURINAME...,2026-01-07,7.15,dihina hama jati diri,2026-01-07|dihina hama jati diri,8SlffHte7gQ,DIHINA HAMA‼️ JATI DIRI SUKU JAWA DI SURINAME & MALAYSIA MALAH BIKIN DUNIA KAGUM!,2026-01-07,565.0,4604.0,0:03:36,38.37,,,,,,,,1.0,80.0,5.0,0.0,79.0,1.0,98.75,19.0,43.0,0.0,0.0,,122.081,17110.146,0.0,17110.146,31132.828,3883.0,9189.146,8017.725,3388.0,3743.738,0.0,2.0,61.0,0.0,0.0,0.0,0.0,0.0,20.0,1.9289,0.5666,5.0,2.5,0.1903,10.0,0.0,0.0,0.0,,,0.0,0.0,0.0,,0.0,0.0,0.0,,17.0,1.37,1237.0,4604.0,277.2188,5.0,17232.227,36984.0,9.84,dihina hama jati diri
JANGAN MAIN-MAIN! TNI KERAHKAN SELURUH ARMADA...,2026-01-07,9.15,jangan main main tni,2026-01-07|jangan main main tni,8SlffHte7gQ,JANGAN MAIN-MAIN! TNI KERAHKAN SELURUH ARMADA KEPUNG JALUR LAUT MALAYSIA DEMI JAGA NEGARA!,2026-01-07,600.0,6723.0,0:03:32,35.39,,,,,,,,0.0,0.0,1.0,0.0,155.0,7.0,95.68,7.0,102.0,0.0,0.0,,217.297,26694.937,0.0,26694.937,48567.113,5839.0,9530.438,8317.711,5096.0,4003.015,0.0,0.0,0.0,0.0,0.0,0.0,0.0,0.0,34.0,1.912,0.8147,11.0,3.6667,0.0958,12.0,3.0,0.0,0.0,,,0.0,0.0,0.0,,0.0,0.0,0.0,,38.0,1.5,2534.0,6723.0,396.5894,1.0,26912.233,36276.0,14.98,jangan main main tni
MALAYSIA TERDIAM! SULTAN BOLKIAH BRUNEI BORONG...,2026-01-07,13.15,malaysia terdiam sultan bolkiah,2026-01-07|malaysia terdiam sultan bolkiah,-Wa5j8Wi51k,MALAYSIA TERDIAM! SULTAN BOLKIAH BRUNEI BORONG SENJATA PT PINDAD JIRAN MAKIN IRI DAN KEPANASAN,2026-01-07,480.0,24393.0,0:03:43,46.5,,,,,,,,0.0,0.0,12.0,5.0,488.0,5.0,98.99,6.0,95.0,0.0,0.0,,1530.249,69486.896,0.0,69486.896,126437.507,17169.0,8676.744,7364.291,14572.0,2911.392,0.0,0.0,0.0,0.0,0.0,0.0,0.0,0.0,190.0,12.4819,,,,0.0334,5.0,0.0,0.0,0.0,,,0.0,0.0,0.0,,0.0,0.0,0.0,,173.0,2.07,8372.0,24393.0,1512.2624,7.0,71017.145,135434.0,15.44,malaysia terdiam sultan bolkiah
ALARM BAHAYA BAGI KAPAL ASING! RUDAL CM-302...,2026-01-07,18.15,alarm bahaya bagi kapal,2026-01-07|alarm bahaya bagi kapal,DRejYsRElh4,"ALARM BAHAYA BAGI KAPAL ASING! RUDAL CM-302 TNI AL SIAP KUNCI PERBATASAN, MALAYSIA JANGAN COBA-COBA!",2026-01-07,623.0,4008.0,0:04:08,39.93,,,,,,,,0.0,0.0,1.0,1.0,104.0,2.0,98.11,3.0,24.0,0.0,0.0,,55.8,23501.088,0.0,23501.088,42745.997,2993.0,16730.332,14281.99,2555.0,5878.934,0.0,3.0,38.0,0.0,0.0,0.0,0.0,0.0,8.0,0.3539,,,,0.2062,6.0,0.0,1.0,0.0,,,0.0,0.0,0.0,,0.0,0.0,0.0,,39.0,3.24,1202.0,4008.0,276.9786,0.0,23556.888,19071.0,16.49,alarm bahaya bagi kapal
INDIA KAGUM! INDONESIA BORONG RUDAL MAUT...,2026-01-07,20.15,india kagum indonesia borong,2026-01-07|india kagum indonesia borong,kVeAFpUZxu8,"INDIA KAGUM! INDONESIA BORONG RUDAL MAUT BRAHMOS, MALAYSIA AUTO KEPANASAN",2026-01-07,504.0,8568.0,0:04:14,50.45,,,,,,,,0.0,0.0,9.0,6.0,275.0,5.0,98.21,7.0,67.0,0.0,0.0,,336.724,28812.483,0.0,28812.483,52423.454,6454.0,9176.169,8122.63,5713.0,3402.102,0.0,1.0,33.0,0.0,0.0,0.0,0.0,0.0,32.0,2.7423,,,,0.1734,1.0,0.0,0.0,0.0,,,0.0,0.0,0.0,,0.0,0.0,0.0,,93.0,1.53,6067.0,8568.0,605.0987,3.0,29149.207,51507.0,13.21,india kagum indonesia borong
ALARM BAHAYA BAGI JIRAN! 42 UNIT RAFALE F4...,2026-01-08,7.15,alarm bahaya bagi jiran,2026-01-08|alarm bahaya bagi jiran,-AH9sFHt0-E,"ALARM BAHAYA BAGI JIRAN! 42 UNIT RAFALE F4 INDONESIA SIAP KEPUNG LANGIT ASEAN, DUNIA KAGUM!",2026-01-08,672.0,16677.0,0:04:30,40.24,,,,,,,,5.0,400.0,9.0,3.0,313.0,6.0,98.12,0.0,55.0,0.0,0.0,,461.573,67256.743,0.0,67256.743,122370.279,15047.0,9946.377,8132.537,12303.0,4060.853,0.0,0.0,0.0,0.0,0.0,0.0,0.0,0.0,56.0,4.2821,1.4341,11.0,3.6667,0.22,4.0,0.0,0.0,0.0,,,0.0,0.0,0.0,,0.0,0.0,0.0,,111.0,2.39,4641.0,16677.0,1252.7652,6.0,67718.317,83583.0,17.27,alarm bahaya bagi jiran
MALAYSIA GAGAL TOTAL! INDONESIA AMBIL ALIH...,2026-01-08,10.15,malaysia gagal total indonesia,2026-01-08|malaysia gagal total indonesia,47xQN20PJtE,MALAYSIA GAGAL TOTAL! INDONESIA AMBIL ALIH PERAN KETUA ASEAN SELAMATKAN MYANMAR DARI KEHANCURAN!,2026-01-08,540.0,6241.0,0:04:20,48.22,,,,,,,,0.0,0.0,1.0,1.0,123.0,1.0,99.19,9.0,32.0,0.0,0.0,,273.804,31043.252,0.0,31043.252,56475.721,5651.0,11805.126,9993.934,4784.0,5017.941,0.0,0.0,0.0,0.0,0.0,0.0,0.0,0.0,31.0,1.9995,,,,0.1832,14.0,0.0,0.0,0.0,,,0.0,0.0,0.0,,0.0,0.0,0.0,,89.0,3.15,2823.0,6241.0,451.4422,0.0,31317.056,27815.0,18.25,malaysia gagal total indonesia
PT PINDAD SIAP TAKLUKKAN AMERIKA LATIN...,2026-01-08,16.15,pt pindad siap taklukkan,2026-01-08|pt pindad siap taklukkan,28_wNAstNZs,"PT PINDAD SIAP TAKLUKKAN AMERIKA LATIN, ALUTSISTA RI JADI REBUTAN NEGARA ASING!",2026-01-08,600.0,9320.0,0:03:38,36.39,,,,,,,,1.0,80.0,1.0,2.0,146.0,1.0,99.32,7.0,23.0,0.0,0.0,,510.474,38943.787,0.0,38943.787,70853.341,7881.0,10665.865,8990.4,6643.0,4233.308,0.0,2.0,79.0,0.0,0.0,0.0,0.0,0.0,50.0,3.8636,0.0357,1.0,1.0,0.0886,5.0,0.0,0.0,0.0,,,0.0,0.0,0.0,,0.0,0.0,0.0,,46.0,1.7,2706.0,9320.0,565.2681,-1.0,39454.261,35671.0,22.58,pt pindad siap taklukkan
INDIA KAGUM! INDONESIA BORONG... (Shorts),2026-01-08,17.0,india kagum indonesia borong,2026-01-08|india kagum indonesia borong,lwt2eQL1AUE,"INDIA KAGUM! INDONESIA BORONG RUDAL MAUT BRAHMOS, MALAYSIA AUTO KEPANASAN",2026-01-08,94.0,13954.0,0:01:26,91.75,82.88,,,,,,,0.0,0.0,9.0,0.0,605.0,25.0,96.03,13.0,36.0,0.0,0.0,,54.322,0.0,0.0,0.0,,,,,,251.951,0.0,12.0,9014.0,0.0,0.0,0.0,0.0,0.0,85.0,0.8847,,,,,0.0,,,0.0,,,0.0,0.0,0.0,,0.0,0.0,0.0,,0.0,,0.0,23804.0,335.8338,9.0,3516.326,25715.0,11.55,india kagum indonesia borong
MEMALUKAN! TENTARA MALAYSIA BUKANNYA BERLATIH...,2026-01-08,19.15,memalukan tentara malaysia bukannya,2026-01-08|memalukan tentara malaysia bukannya,lwt2eQL1AUE,"MEMALUKAN! TENTARA MALAYSIA BUKANNYA BERLATIH, MALAH BAWA “PEL4CUR” KE CAMP MILITER!",2026-01-08,573.0,11361.0,0:03:49,40.11,,,,,,,,0.0,0.0,0.0,1.0,224.0,3.0,98.68,14.0,224.0,0.0,0.0,,705.003,38932.268,0.0,38932.268,70833.36,8897.0,9151.597,7961.488,7740.0,3484.196,0.0,0.0,0.0,0.0,0.0,0.0,0.0,0.0,81.0,5.9822,1.5674,14.0,2.8,0.1924,11.0,0.0,0.0,0.0,,,0.0,0.0,0.0,,0.0,0.0,0.0,,101.0,2.86,3534.0,11361.0,725.2262,-1.0,39637.271,52884.0,17.29,memalukan tentara malaysia bukannya
TIMOR LESTE KENA TIPU AUSTRALIA! KINI MENYESAL...,2026-01-09,7.3,timor leste kena tipu,2026-01-09|timor leste kena tipu,Ch4clAxjmoc,TIMOR LESTE KENA TIPU AUSTRALIA! KINI MENYESAL PISAH DARI INDONESIA,2026-01-09,498.0,5780.0,0:03:36,43.46,,,,,,,,0.0,0.0,3.0,0.0,108.0,2.0,98.18,5.0,85.0,0.0,0.0,,283.251,23396.63,0.0,23396.63,42568.807,5116.0,9236.018,8320.721,4609.0,4099.734,0.0,5.0,105.0,0.0,0.0,0.0,0.0,0.0,28.0,2.1961,,,,0.1715,4.0,0.0,0.0,0.0,,,0.0,0.0,0.0,,0.0,0.0,0.0,,52.0,2.19,2379.0,5780.0,347.5227,3.0,23679.881,37039.0,12.13,timor leste kena tipu
MALAYSIA HEBOH! PRABOWO TAK GENTAR! INDONESIA...,2026-01-09,13.15,malaysia heboh prabowo tak,2026-01-09|malaysia heboh prabowo tak,yvCkF--P7RY,MALAYSIA HEBOH! PRABOWO TAK GENTAR! INDONESIA KECAM INTERVENSI AS DI VENEZUELA,2026-01-09,600.0,7954.0,0:03:44,37.47,,,,,,,,0.0,0.0,3.0,2.0,117.0,0.0,100.0,7.0,36.0,0.0,0.0,,299.315,41510.481,0.0,41510.481,75517.122,8189.0,10923.929,9221.776,6913.0,5256.458,0.0,5.0,78.0,0.0,0.0,0.0,0.0,0.0,31.0,2.2861,,,,0.1999,16.0,0.0,0.0,0.0,,,0.0,0.0,0.0,,0.0,0.0,0.0,,87.0,2.03,4285.0,7954.0,496.788,1.0,41809.796,26740.0,22.86,malaysia heboh prabowo tak
MALAYSIA DIJAJAH! WARGA BANGLADESH BERJAYA...,2026-01-09,19.15,malaysia dijajah warga bangladesh,2026-01-09|malaysia dijajah warga bangladesh,AOlKLni2SuM,"MALAYSIA DIJAJAH! WARGA BANGLADESH BERJAYA KUASAI EKONOMI, KAUM MELAYU MULAI KEJANG-KEJANG!",2026-01-09,668.0,10306.0,0:04:16,38.42,,,,,,,,0.0,0.0,4.0,0.0,142.0,4.0,97.26,15.0,166.0,0.0,0.0,,540.894,29815.166,0.0,29815.166,54253.407,7836.0,8014.981,6923.61,6769.0,2947.532,0.0,0.0,0.0,0.0,0.0,0.0,0.0,0.0,49.0,4.655,,,,0.2189,0.0,1.0,0.0,0.0,,,0.0,0.0,0.0,,0.0,0.0,0.0,,71.0,2.68,2653.0,10306.0,734.7453,4.0,30356.06,66573.0,13.48,malaysia dijajah warga bangladesh
